title,href,subhead,premium,image,byline,type
French government criticized over climate record and sluggish heatwave response,https://www.lemonde.fr/en/politics/article/2026/06/29/french-government-criticized-over-climate-record-and-sluggish-heatwave-response_6754968_5.html,"While Prime Minister Sébastien Lecornu has chosen to communicate minimally to avoid appearing nervous, French President Emmanuel Macron has been irritated by the criticism and has insisted that he has done 'a great deal of work.'",Subscribers only,https://img.lemde.fr/2026/06/09/2781/0/5333/3555/400/266/75/0/8514ddb_upload-1-a751gubiuivl-jmug260609039.jpg,,
"Identitarian group Némésis funds itself through PayPal, which turns a blind eye",https://www.lemonde.fr/en/les-decodeurs/article/2026/06/29/identitarian-group-nemesis-funds-itself-through-paypal-which-turns-a-blind-eye_6754963_8.html,,Subscribers only,https://img.lemde.fr/2026/02/21/0/0/8256/5504/398/265/75/0/f3eae2d_ftp-1-2unfcndk7f3x-5254643-01-06.jpg,,
"Despite tensions, France will join New York festivities for America's 250th anniversary",https://www.lemonde.fr/en/international/article/2026/06/29/despite-tensions-france-will-join-new-york-festivities-for-america-s-250th-anniversary_6754970_4.html,,Subscribers only,https://img.lemde.fr/2026/06/18/333/0/5000/3333/398/265/75/0/d0c2bc7_upload-1-wtbhbohtjzoj-kzihnioglu-evian-g7-15062026-3-84.JPG,,
France's fantasy balls: 'We identify with the lives of castle dwellers from a bygone era',https://www.lemonde.fr/en/france/article/2026/06/29/france-s-fantasy-balls-we-identify-with-the-lives-of-castle-dwellers-from-a-bygone-era_6754962_7.html,"Blending historical and fantastical references, fantasy balls promise a leap through time and a touch of magic in worlds reminiscent of the 'Bridgerton' series or 'Alice in Wonderland.' These evenings are as much about dance as they are about spectacle.",Subscribers only,https://img.lemde.fr/2026/06/22/0/0/4724/3149/398/265/75/0/a05b0db_upload-1-f7joypqiakn2-14-a31a7403.jpg,,
250 years of American independence: The retreat from multiracial democracy,https://www.lemonde.fr/en/international/article/2026/06/28/250-years-of-american-independence-the-retreat-from-multiracial-democracy_6754953_4.html,"'America 250' (7/13). A century after its founding, 38 states made up the nation. Deep divisions persisted over how to treat the Black population. Slavery had been abolished, much to the dismay of the Democrats, who were gaining ground. Although the Republicans won the presidential election, their victory came at the cost of institutionalizing segregationist policies in the Southern states.",Subscribers only,https://img.lemde.fr/2026/06/24/0/300/3240/2160/398/265/75/0/f31cf6b_upload-1-zk0gq5a3ozhv-capture-d-e-cran-2026-06-24-a-17-28-39-3.jpg,,
"'Life, Larry and the Pursuit of Unhappiness' on HBO Max: An irreverent take on key moments in US history",https://www.lemonde.fr/en/culture/article/2026/06/29/life-larry-and-the-pursuit-of-unhappiness-on-hbo-max-an-irreverent-take-on-key-moments-in-us-history_6754967_30.html,"Produced by Michelle and Barack Obama, the limited series lets Larry David, co-creator of 'Seinfeld,' take a comedic wrecking ball to American mythology.",Subscribers only,https://img.lemde.fr/2026/06/25/274/0/800/533/398/265/75/0/dd3c433_upload-1-txokqtgdgfjv-life-larry-and-the-pursuit-of-unhappiness-1.jpg,,
"At the Four Seasons in Damascus, power shifts but the elite remain",https://www.lemonde.fr/en/m-le-mag/article/2026/06/29/at-the-four-seasons-in-damascus-power-shifts-but-the-elite-remain_6754961_117.html,"A symbol of Bashar al-Assad's grip on Syria, the luxury hotel was the scene of lavish parties and business dealings until the fall of the dictator in December 2024. After briefly serving as the headquarters for the new leaders, it is now a networking hub for entrepreneurs seeking business opportunities in a country where everything must be rebuilt.",Subscribers only,https://img.lemde.fr/2026/06/22/0/0/1500/1000/664/442/75/0/2717b74_ftp-1-sqpfyz1hpkmg-433099-3471802.jpg,Nissim Gasteli,Feature
Israeli strikes further weakens deal between Israel and Lebanon,https://www.lemonde.fr/en/international/article/2026/06/29/agreement-signed-between-israel-and-lebanon-is-further-weakened-by-israeli-strikes-and-the-lebanese-parliament-speaker-s-rejection-of-the-text_6754960_4.html,,,https://img.lemde.fr/2026/06/28/0/0/5869/3913/198/132/95/0/d53a8f8_ftp-1-zmqalozjpmuu-5472123-01-06.jpg,,
French research thrown into turmoil by a multifaceted crisis,https://www.lemonde.fr/en/science/article/2026/06/28/french-research-thrown-into-turmoil-by-a-multifaceted-crisis_6754955_10.html,,Subscribers only,https://img.lemde.fr/2026/06/22/635/0/2681/1787/198/132/95/0/9419823_upload-1-vtcu2y3ao1ei-cnrsbudget-hd.jpg,,
'The basic assumption is that men know': Bars showing the 2026 World Cup confront everyday sexism,https://www.lemonde.fr/en/sports/article/2026/06/28/the-basic-assumption-is-that-men-know-bars-showing-the-2026-world-cup-confront-everyday-sexism_6754956_9.html,,Subscribers only,https://img.lemde.fr/2026/06/27/312/0/1890/1260/198/132/95/0/893dde7_upload-1-ve6kcnxbmabx-010-millerand-5h9a4061.jpg,,
How Côte d'Ivoire's late president built secret ties with Africa's beer giant,https://www.lemonde.fr/en/les-decodeurs/article/2026/06/29/how-cote-d-ivoire-s-late-president-built-secret-ties-with-africa-s-beer-giant_6754959_8.html,,Subscribers only,https://img.lemde.fr/2026/06/18/0/0/3853/2568/198/132/95/0/db0125a_upload-1-tp0khtlzcsm9-le-monde-openlux-a-final.jpg,,
'Better an imperfect digital euro than no digital euro at all',https://www.lemonde.fr/en/opinion/article/2026/06/29/better-an-imperfect-digital-euro-than-no-digital-euro-at-all_6754958_23.html,,Subscribers only,,,
"From a Russian prison to a European music festival, the escape of a young anti-Putin singer",https://www.lemonde.fr/en/m-le-mag/article/2026/06/27/from-a-russian-prison-to-a-european-music-festival-the-escape-of-a-young-anti-putin-singer_6754932_117.html,,Subscribers only,,,
"From France to Italy, inside the counterfeit rings circulating fake banknotes across Europe via social media",https://www.lemonde.fr/en/france/article/2026/06/28/from-france-to-italy-inside-the-counterfeit-rings-circulating-fake-banknotes-across-europe-via-social-media_6754949_7.html,,Subscribers only,,,
"In the age of AI, Chinese universities overhaul their curricula",https://www.lemonde.fr/en/international/article/2026/06/26/in-the-age-of-ai-chinese-universities-overhaul-their-curricula_6754915_4.html,,Subscribers only,,,
"Heatwave fuels frustration in Paris's northern suburbs: 'If they'd just given us shutters, we wouldn't be suffering like this'",https://www.lemonde.fr/en/france/article/2026/06/26/heatwave-fuels-frustration-in-paris-s-northern-suburbs-if-they-d-just-given-us-shutters-we-wouldn-t-be-suffering-like-this_6754913_7.html,,Subscribers only,,,
'I just want to know if he's still alive': The long ordeal of families searching for loved ones lost at sea,https://www.lemonde.fr/en/international/article/2026/06/28/i-just-want-to-know-if-he-s-still-alive-the-long-ordeal-of-families-searching-for-loved-ones-lost-at-sea_6754938_4.html,,Subscribers only,,,
"'Their mouths, eyes, hands, were taped and they were thrown into the hole': Russian soldiers confront Putin with reality of front lines",https://www.lemonde.fr/en/international/article/2026/06/28/their-mouths-eyes-hands-were-taped-and-they-were-thrown-into-the-hole-russian-soldiers-confront-putin-with-reality-of-front-lines_6754954_5.html,"A Russian exile media outlet has analyzed nearly 7,000 letters from Russian soldiers and their families to the Kremlin thanks to a security flaw.",Subscribers only,https://img.lemde.fr/2026/06/25/673/0/4000/2666/664/442/75/0/68f1786_upload-1-on67o7s23kgh-008.JPG,Benjamin Quénelle,News
To join the 'system' or overturn it? Bardella's private life and policies raise doubts,https://www.lemonde.fr/en/politics/article/2026/06/28/to-join-the-system-or-overturn-it-far-right-leader-bardella-s-private-life-and-policies-raise-doubts_6754951_5.html,"By openly seeking to appeal to economic elites and the right, far-right leader Jordan Bardella breaks with Marine Le Pen and her father's historic 'anti-system' hostility. Some party members question his desire to pursue radical policies.",Subscribers only,https://img.lemde.fr/2026/06/22/1/0/8192/5461/664/442/75/0/bb25d3c_upload-1-9d9bvj70aohr-abaca-1004299-010.jpg,Clément Guillou,News analysis
'Our infrastructure was designed for a climate that no longer exists': France's unfinished reckoning with increasing heatwaves,https://www.lemonde.fr/en/france/article/2026/06/28/our-infrastructure-was-designed-for-a-climate-that-no-longer-exists-france-s-unfinished-reckoning-with-increasing-heatwaves_6754944_7.html,"In 2003, an unprecedented heatwave struck France in the middle of August while the government was on vacation. It killed 15,000 people. While this public health shock transformed the alert system and the management of heat-related illnesses, France has failed to learn any lessons regarding its necessary adaptation to climate change.",Subscribers only,https://img.lemde.fr/2026/06/27/0/89/2157/1438/664/442/75/0/c290e64_upload-1-fo1fmlio2ic0-000-par2003081351124.jpg,,News
France heatwave: Why adaptation and mitigation must go hand in hand,https://www.lemonde.fr/en/opinion/article/2026/06/27/france-heatwave-why-adaptation-and-mitigation-must-go-hand-in-hand_6754930_23.html,,,,Le Monde,Editorial
'Is the Gulf Persian or Arabian? Or both?',https://www.lemonde.fr/en/international/article/2026/06/28/is-the-gulf-persian-or-arabian-or-both_6754946_4.html,,Subscribe,https://img.lemde.fr/2023/07/31/0/0/0/0/100/100/60/0/d45bb07_1690791602941-eac5c14-1647333440018-jean-pierre-filiu-2019.jpg,Jean-Pierre Filiu,Column
'The special tribunal on the aggression against Ukraine could be a major step toward protecting the legal architecture built after World War II',https://www.lemonde.fr/en/international/article/2026/06/25/the-special-tribunal-on-ukraine-s-aggression-could-be-a-major-step-toward-protecting-the-legal-architecture-built-after-world-war-ii_6754844_4.html,,Subscribe,,Stéphanie Maupas,Interview
