title,href,subhead,premium,image,byline,type
The possible outcomes of Marine Le Pen's trial,https://www.lemonde.fr/en/france/article/2026/07/06/the-possible-outcomes-of-marine-le-pen-s-trial_6755208_7.html,"On Tuesday, the Paris Court of Appeals will deliver its decision in the embezzlement case that could prevent the French far right's leader from running for president.",Subscribers only,https://img.lemde.fr/2026/02/11/0/1/4867/3245/400/266/75/0/f9270e5_ftp-1-zkhsynxtggcc-2026-02-11t122413z-1469004740-rc2ojjaxoarw-rtrmadp-3-france-politics-le-pen.JPG,,
France faces new heatwave with temperatures reaching 40°C,https://www.lemonde.fr/en/environment/article/2026/07/06/france-faces-new-heatwave-with-temperatures-reaching-40-c_6755211_114.html,,Subscribers only,https://img.lemde.fr/2026/07/06/0/0/5830/3886/398/265/75/0/b366c3f_ftp-1-gn33vzghjsci-5549413-01-06.jpg,,
2026 World Cup: Spain beat Portugal 1-0 to reach quarter-finals,https://www.lemonde.fr/en/sports/article/2026/07/07/spain-beat-portugal-1-0-to-reach-world-cup-quarter-finals_6755214_9.html,,,https://img.lemde.fr/2026/07/06/0/33/1467/978/398/265/75/0/67a6e6a_ftp-1-lc2c1djzwdkl-2026-07-06t213720z-1234690515-up1em761o27r2-rtrmadp-3-soccer-worldcup-por-esp.JPG,,
French PM survives no-confidence vote over heatwave response,https://www.lemonde.fr/en/politics/article/2026/07/06/french-pm-survives-no-confidence-vote-over-heatwave-response_6755212_5.html,"The motion followed five days of unseasonably high temperatures in May, then a record-breaking 11-day heatwave in June, which led to school closures and cancelled festivals throughout France.",,https://img.lemde.fr/2026/07/06/0/0/7074/4716/398/265/75/0/f245a5f_ftp-1-xmmfouksvi2i-5548462-01-06.jpg,,
"Netflix, Prime Video and Disney+ challenge new French investment rules",https://www.lemonde.fr/en/economy/article/2026/07/06/netflix-prime-video-and-disney-challenge-new-french-investment-rules_6755196_19.html,"The streaming services filed appeals to contest a new rule that requires them to dedicate 20% of their mandatory investment in French audiovisual content to animation, documentaries and live performance programming.",Subscribers only,https://img.lemde.fr/2026/07/05/46/0/7521/5014/398/265/75/0/21d351a_upload-1-cohzs8jzgige-063-2250243524.jpg,,
'A despicable woman unworthy of her office': Kylian Mbappé responds to racist remarks from Paraguayan senator,https://www.lemonde.fr/en/sports/article/2026/07/06/a-despicable-woman-unworthy-of-her-office-kylian-mbappe-responds-to-racist-remarks-from-paraguayan-senator_6755213_9.html,The captain of the French national football team responded on Monday to a racist message posted by Celeste Amarilla. The Paraguayan politician's comments came in the wake of the Albirroja's defeat by Les Bleus in the round of 16 of the World Cup.,,https://img.lemde.fr/2026/03/25/0/0/6000/4000/398/265/75/0/3ab42f4_ftp-1-kmfa0uebc7la-5588505-01-06.jpg,,
Somaliland's high-risk quest for recognition,https://www.lemonde.fr/en/le-monde-africa/visuel/2026/07/06/somaliland-s-high-risk-quest-for-recognition_6755178_124.html,"The self-proclaimed republic aspires to accede to the international stage. It finds itself at the center of a game of alliances, caught between Israeli, American and Emirati ambitions and threats from Yemen and neighboring Somalia.",Subscribers only,https://img.lemde.fr/2026/04/17/0/277/834/556/664/442/75/0/d45b9ef_upload-1-rlyoptcq4o8u-plan-de-travail-3mediaappel2.png,Francesca Fattori and  Noé Hochet-Bodin,Visual Story
"Venezuela quake death toll tops 3,500",https://www.lemonde.fr/en/environment/article/2026/07/06/as-venezuela-quake-death-toll-tops-3-300-dozens-of-unidentified-bodies-buried_6755183_114.html,,,https://img.lemde.fr/2026/07/06/0/177/5118/3412/198/132/95/0/22aee9e_ftp-1-peflxpumtbgq-5546458-01-06.jpg,,
Resigned Le Pen puts on brave face before crucial court decision,https://www.lemonde.fr/en/politics/article/2026/07/06/resigned-le-pen-puts-on-brave-face-before-crucial-court-decision_6755180_5.html,,Subscribers only,https://img.lemde.fr/2026/07/05/0/0/6000/4000/198/132/95/0/0a2a4d1_upload-1-1f6wbilk2qcb-cbi1322016.jpg,,
EU tells France to amend social media ban law,https://www.lemonde.fr/en/france/article/2026/07/06/eu-tells-france-to-amend-social-media-ban-law_6755209_7.html,,,https://img.lemde.fr/2026/07/01/0/19/5961/3974/198/132/95/0/6d193c0_ftp-1-dvjz4rjfrseg-2026-07-01t025200z-2073416059-rc2yykasm0gp-rtrmadp-3-eu-antitrust-aligntechnology.JPG,,
Pogacar wins Tour de France third stage and takes yellow jersey,https://www.lemonde.fr/en/sports/article/2026/07/06/pogacar-wins-tour-de-france-third-stage-and-takes-yellow-jersey_6755202_9.html,,,https://img.lemde.fr/2026/07/06/27/0/2759/1839/198/132/95/0/4329055_ftp-1-veabwkzfbcds-2026-07-06t151937z-1884145434-up1em7616kovf-rtrmadp-3-cycling-france.JPG,,
Politicial scientist Alexandra de Hoop Scheffer: 'The United States is grappling with strategic saturation',https://www.lemonde.fr/en/international/article/2026/07/06/politicial-scientist-alexandra-de-hoop-scheffer-the-us-is-pursuing-a-strategy-of-strategic-saturation_6755177_4.html,,Subscribers only,,,
Edouard Philippe outlines moderate right-wing vision for 'French recovery',https://www.lemonde.fr/en/politics/article/2026/07/06/2027-presidential-election-philippe-outlines-moderate-right-wing-vision-for-french-recovery_6755200_5.html,,Subscribers only,,,
"Frenchman jailed in missing body case confesses to killing wife, says his lawyer",https://www.lemonde.fr/en/france/article/2026/07/06/frenchman-jailed-in-missing-body-case-confesses-to-killing-wife-says-his-lawyer_6755206_7.html,,,,,
Hamas says it has dissolved its governing bodies in the Gaza Strip,https://www.lemonde.fr/en/international/article/2026/07/06/hamas-says-it-has-dissolved-its-governing-bodies-in-the-gaza-strip_6755197_4.html,,,,,
Trump confirms he pushed FIFA to review Balogun's red card,https://www.lemonde.fr/en/sports/article/2026/07/06/trump-confirms-he-pushed-fifa-to-review-balogun-s-red-card_6755205_9.html,,,,,
UAE discreetly builds military base in Somaliland for US and Israel,https://www.lemonde.fr/en/le-monde-africa/article/2026/07/06/uae-discreetly-builds-military-base-in-somaliland-for-us-and-israel_6755184_124.html,,Subscribers only,,,
Ukraine's gas stations are increasingly targeted by Russian drones,https://www.lemonde.fr/en/international/article/2026/07/06/ukraine-s-gas-stations-increasingly-targeted-by-russian-drones_6755204_4.html,,Subscribers only,,,
France pulls all diplomats from Burkina Faso,https://www.lemonde.fr/en/burkina-faso/article/2026/07/06/france-pulls-all-diplomats-from-burkina-faso_6755207_222.html,,,,,
Politicial scientist Alexandra de Hoop Scheffer: 'The United States is grappling with strategic saturation',https://www.lemonde.fr/en/international/article/2026/07/06/politicial-scientist-alexandra-de-hoop-scheffer-the-us-is-pursuing-a-strategy-of-strategic-saturation_6755177_4.html,"According to the president of the German Marshall Fund, the US, which is engaged on multiple fronts, is renegotiating the transatlantic contract unilaterally by pressuring its European allies to take responsibility for their own security. This 'burden shifting' challenges Europe to coordinate the organization of its defense industries.",Subscribers only,https://img.lemde.fr/2026/07/02/840/0/2363/1575/664/442/75/0/9462a4d_upload-1-z1lo2v8iepvg-mark-dion-between-voltaire-and-poe-hd-rafaele-fanelli-de-toure-rvb.jpg,Piotr Smolar,Interview
"Vladimir Putin, or the loneliness of 'Homo Sovieticus'",https://www.lemonde.fr/en/international/article/2026/07/05/vladimir-putin-or-the-loneliness-of-homo-sovieticus_6755172_4.html,"Between denial of reality, a desire for revenge and carefully crafted messaging, the Russian president has tried to position himself as the master of the game. But after more than four years of war in Ukraine, these old tricks inherited from the Soviet past are showing their limitations, and he is losing credibility.",Subscribers only,https://img.lemde.fr/2026/06/22/0/0/6000/4000/664/442/75/0/8a5368f_upload-1-rztcakfyvjwj-015.JPG,Marie Jégo,Long Read
You can get good Latin American food in Paris. Here's where,https://www.lemonde.fr/en/food/article/2026/07/05/you-can-get-good-latin-american-food-in-paris-here-s-where_6755168_119.html,"From colorful market stalls to a welcoming restaurant dining room, here is our selection of places to discover Colombian, Argentinian or Brazilian dishes in Paris.",Subscribers only,https://img.lemde.fr/2026/06/26/473/0/3677/2451/664/442/75/0/40de086_upload-1-r275qlwivvxl-arepa-de-huevo.jpeg,Zazie Tavitian,Selection
Pope Leo XIV's reminder of the duty of humanity toward migrants,https://www.lemonde.fr/en/opinion/article/2026/07/06/pope-leo-xiv-s-reminder-of-the-duty-of-humanity-toward-migrants_6755201_23.html,,,,Le Monde,Editorial
"'Diverse France, that of Kylian Mbappé and the national team, is too promising a reality to be used as an electoral punching bag'",https://www.lemonde.fr/en/opinion/article/2026/07/05/diverse-france-that-of-kylian-mbappe-and-the-national-team-is-too-promising-a-reality-to-be-used-as-an-electoral-punching-bag_6755175_23.html,,Subscribe,https://img.lemde.fr/2025/02/13/0/0/0/0/100/100/60/0/e49d71b_sirius-fs-upload-1-hfccvvna5map-1739442970267-capture-da-a-cran-2025-02-13-113500.png,Philippe Bernard,Column
"'With Trump, the Founding Fathers' belief in the exemplary nature of US presidents has been lost'",https://www.lemonde.fr/en/opinion/article/2026/07/04/with-trump-the-founding-fathers-belief-in-the-exemplary-nature-of-us-presidents-has-been-lost_6755145_23.html,,Subscribe,https://img.lemde.fr/2022/03/18/0/0/0/0/100/100/60/0/bfe4dc9_1647595527633-f2df5fa-237.jpeg,Gilles Paris,Column
