title,href,subhead,premium,image,type,byline
Climate scientists aren't surprised by summer's record heat: 'We've entered a dangerous zone',https://www.lemonde.fr/en/environment/article/2026/07/21/climate-scientists-aren-t-surprised-by-summer-s-record-heat-we-ve-entered-a-dangerous-zone_6755684_114.html,"Record heat, historic drought and sweeping wildfires have marked France's 2026 summer. Yet climate scientists mostly see global warming's expected effects playing out. Only the rapid succession of heatwaves has caught them off guard.",Subscribers only,https://img.lemde.fr/2026/06/25/168/0/4000/2666/400/266/75/0/8be6d71_upload-1-w8mo3vjsz1f3-raf-paris-canicule-nocturne-037.JPG,,
China's AI doctrine is a challenge for Europe,https://www.lemonde.fr/en/opinion/article/2026/07/21/china-s-ai-doctrine-is-a-challenge-for-europe_6755686_23.html,,,https://img.lemde.fr/2026/07/17/0/0/8114/5409/398/265/75/0/68a3d5f_ftp-1-jazann3gnehv-5644447-01-06.jpg,Editorial,
"France set to ban social media for under-15s, a first in the EU",https://www.lemonde.fr/en/france/article/2026/07/21/france-set-to-pass-eu-first-ban-on-social-media-for-under-15s_6755681_7.html,,,https://img.lemde.fr/2026/07/20/0/0/3000/2000/398/265/75/0/578f258_ftp-1-7ggyw3sossps-2026-07-20t100034z-1209198033-rc2vpga7sdcs-rtrmadp-3-meta-trial-tennessee.JPG,,
Iran bets on war of attrition against the US,https://www.lemonde.fr/en/international/article/2026/07/21/iran-bets-on-war-of-attrition-against-the-us_6755680_4.html,"As US airstrikes persist in Iran, Iranian authorities are, for now, avoiding a full-scale confrontation. Their strategy is to leverage the threat of global energy disruption to force Washington to reconsider its approach.",Subscribers only,https://img.lemde.fr/2026/07/21/0/300/3240/2160/398/265/75/0/6023bb4_upload-1-tfgml9g3kju5-mei202607197789.jpg,,
"Between China and the US, a new diplomacy of detainees emerges",https://www.lemonde.fr/en/international/article/2026/07/21/between-china-and-the-us-a-new-diplomacy-of-detainees-emerges_6755667_4.html,"Alongside the major issues discussed between the world's two leading powers, the fate of American citizens imprisoned in China on espionage charges has also become a bargaining chip.",Subscribers only,https://img.lemde.fr/2026/07/17/211/0/1363/908/398/265/75/0/8d47dab_upload-1-1sm6mmni594q-02b13946-d026-4635-ae7e-26ad484b67ad.JPG,,
"In Canada, great white sharks settle in for summer in the Gulf of Saint Lawrence",https://www.lemonde.fr/en/environment/article/2026/07/20/in-canada-great-white-sharks-settle-in-for-summer-in-the-gulf-of-saint-lawrence_6755665_114.html,"The species has become a regular and seasonal visitor to the waters of eastern Canada. Its growing presence is due in part to ocean warming, as well as to the abundance of gray seals, which are a key food source.",Subscribers only,https://img.lemde.fr/2026/07/17/106/0/2559/1706/398/265/75/0/34327e1_upload-1-0e2fn4imzxdv-90386920007-bella-shark.jpg,,
"Bernard Arnault, a 'free-marketeer' who whispers in the ear of every president",https://www.lemonde.fr/en/summer-reads/article/2026/07/21/bernard-arnault-a-free-marketeer-who-whispers-in-the-ear-of-every-president_6755675_183.html,"'Bernard Arnault's Empire' (2/6). LVMH's boss has never hidden his allegiance to France's pro-business, establishment right. He's close to fellow billionaire Vincent Bolloré and, above all, pragmatic. Now he's preparing for the far right's rise to power.",Subscribers only,https://img.lemde.fr/2026/07/16/0/0/2665/1777/664/442/75/0/a4d6de5_upload-1-isqqe01u1htp-000-9na3td.jpg,Investigation,Raphaëlle Bacqué and  Vanessa Schneider
Burnham enters Downing Street and appoints former defense minister John Healey as chancellor of the Exchequer,https://www.lemonde.fr/en/international/article/2026/07/21/andy-burnham-enters-downing-street-and-appoints-former-defense-minister-john-healey-as-chancellor-of-the-exchequer_6755671_4.html,,Subscribers only,https://img.lemde.fr/2026/07/20/0/0/5941/3960/198/132/95/0/e385e9c_ftp-1-gdxlmynt6phz-5667195-01-06.jpg,,
Repeated heatwaves fuel eco-anxiety and anger among youth: 'It feels like we're living in a dystopia',https://www.lemonde.fr/en/campus/article/2026/07/21/repeated-heatwaves-fuel-eco-anxiety-and-anger-among-youth-it-feels-like-we-re-living-in-a-dystopia_6755674_11.html,,Subscribers only,https://img.lemde.fr/2026/07/14/0/30/3543/2362/198/132/95/0/7591f29_upload-1-uezoeglab8jp-ecoanxietehd.jpg,,
Climate change: Why the ECB refuses to create a lower interest rate for green investments,https://www.lemonde.fr/en/economy/article/2026/07/21/climate-change-why-the-ecb-refuses-to-create-a-lower-interest-rate-for-green-investments_6755672_19.html,,Subscribers only,https://img.lemde.fr/2026/07/03/0/0/5500/3666/198/132/95/0/ec1e6b2_ftp-1-u7xfrrbcocep-2026-07-03t072138z-670829081-rc2prla24tvf-rtrmadp-3-ecb-policy-lagarde.JPG,,
Is air conditioning good or bad? Join this (fake) group chat for (real) analysis,https://www.lemonde.fr/en/les-decodeurs/article/2026/07/10/is-air-conditioning-good-or-bad-join-this-fake-group-chat-for-real-analysis_6755351_8.html,,Subscribers only,https://img.lemde.fr/2026/06/30/0/0/5735/3823/198/132/95/0/4710dd2_ftp-1-0pwutsr4roga-9b14fba68ce0495bb521ecfcbe7db159-2-5b9feaf45d55480e85a0beac5c279ede.jpg,,
France's must-see art exhibitions this summer,https://www.lemonde.fr/en/culture/article/2026/07/19/france-s-must-see-art-exhibitions-this-summer_6755615_30.html,,Subscribers only,,,
"Two months before Russian parliamentary elections, antiwar voices still struggle for traction",https://www.lemonde.fr/en/international/article/2026/07/21/two-months-before-russian-parliamentary-elections-antiwar-voices-still-struggle-for-traction_6755677_4.html,,Subscribers only,,,
Far-right mayor cancels show dedicated to Queen in Southern France,https://www.lemonde.fr/en/culture/article/2026/07/21/far-right-mayor-cancels-show-dedicated-to-queen-in-southern-france_6755683_30.html,,Subscribers only,,,
Two tourists stabbed near Acropolis in rare Athens knife attack,https://www.lemonde.fr/en/international/article/2026/07/21/two-tourists-stabbed-near-acropolis-in-rare-athens-knife-attack_6755682_4.html,,,,,
"Cleanliness in Paris: Study reveals 1,412 spots left systematically unclean",https://www.lemonde.fr/en/politics/article/2026/07/20/cleanliness-in-paris-study-reveals-1-412-spots-left-systematically-unclean_6755662_5.html,,Subscribers only,,,
"In southern Lebanon hospital, caregivers strive to overcome traumas of war",https://www.lemonde.fr/en/international/article/2026/07/21/in-southern-lebanon-at-the-secours-populaire-hospital-in-nabatieh-caregivers-strive-to-overcome-the-traumas-of-war_6755669_4.html,,Subscribers only,,,
"Laurent Nuñez, French interior minister: 'Trusting police officers and gendarmes never means shielding them from judicial oversight'",https://www.lemonde.fr/en/opinion/article/2026/07/21/laurent-nunez-french-interior-minister-trusting-police-officers-and-gendarmes-never-means-shielding-them-from-judicial-oversight_6755679_23.html,,Subscribers only,,,
Seafood and veggie tide inundates dining tables on the Basque coast,https://www.lemonde.fr/en/lifestyle/article/2026/05/01/seafood-and-veggie-tide-inundates-dining-tables-on-the-basque-coast_6753036_37.html,,Subscribers only,,,
"In Paris café, terror attack survivors find community: 'People want to tell each other: I am alive'",https://www.lemonde.fr/en/m-le-mag/article/2026/07/20/in-a-paris-cafe-terror-attack-survivors-find-community-people-want-to-tell-each-other-i-am-alive_6755639_117.html,"After long days attending the 2015 Paris attacks trial, survivors and relatives of victims met in a bar to comfort one another. They have continued to gather every month, joined by victims of other attacks, to share experiences, advice and, above all, laughter and good company.",Subscribers only,https://img.lemde.fr/2026/07/10/0/0/6000/4000/664/442/75/0/44d1e7e_upload-1-6b4nolnp8bpr-774-mag-victimes-035.jpg,Feature,Henri Seckel
"French 'libertines' rapes case: From livestreams to camp sites, where the sexual crimes took place",https://www.lemonde.fr/en/france/article/2026/07/20/french-libertines-rapes-case-from-livestreams-to-camp-sites-where-the-sexual-crimes-took-place_6755660_7.html,"Christophe B. and many other men he recruited are accused of raping women, with these sexual assaults broadcast online and in public. Responsibility is now being called into question. This is the final part of our investigation into the French 'libertines' rapes case.",Subscribers only,https://img.lemde.fr/2026/07/15/0/0/6378/4252/664/442/75/0/2659e9b_upload-1-nxlurhwkaspg-bordeaux-viols-def.jpg,Investigation,"Jérôme Lefilliâtre,  Lorraine de Foucher  and  Morgane Tual"
"Inside the court of France's richest man, Bernard Arnault",https://www.lemonde.fr/en/summer-reads/article/2026/07/19/bernard-arnault-inside-the-court-of-france-s-richest-man_6755617_183.html,'Bernard Arnault's Empire' (1/6). The billionaire at the head of LVMH is as secretive as he is powerful. He relies on a devoted entourage in which a mix of fear and admiration prevails.,Subscribers only,https://img.lemde.fr/2026/07/16/1736/0/4000/2666/664/442/75/0/3630522_upload-1-tarby5yocvaj-l1070311.jpg,Investigation,Raphaëlle Bacqué and  Vanessa Schneider
China's AI doctrine is a challenge for Europe,https://www.lemonde.fr/en/opinion/article/2026/07/21/china-s-ai-doctrine-is-a-challenge-for-europe_6755686_23.html,,,,Editorial,Le Monde
'Can we continue to entrust global sport to organizations more concerned with their financial interests than with the public good?',https://www.lemonde.fr/en/opinion/article/2026/07/19/can-we-continue-to-entrust-global-sport-to-organizations-more-concerned-with-their-financial-interests-than-with-the-public-good_6755619_23.html,,Subscribe,,Op-Ed,Frédérique Reynertz  and  Pim Verschuuren
"In a world in turmoil, 'Hamlet' has never been more relevant",https://www.lemonde.fr/en/opinion/article/2026/07/19/in-a-world-in-turmoil-hamlet-has-never-been-more-relevant_6755613_23.html,,Subscribe,,News analysis,Joëlle Gayot
