title,href,subhead,premium,image,byline,type
How Le Pen and Bardella are wooing French and foreign diplomats,https://www.lemonde.fr/en/international/article/2026/07/06/how-le-pen-and-bardella-are-wooing-french-and-foreign-diplomats_6755191_4.html,The far-right Rassemblement National is trying to quash accusations of incompetence in foreign policy. It is relying on a handful of senior civil servants from France's foreign ministry.,Subscribers only,https://img.lemde.fr/2026/07/03/0/0/4321/2881/400/266/75/0/b403fcd_upload-1-nw9unumra1rc-000-37xe363.jpg,,
Edouard Philippe outlines moderate right-wing vision for 'French recovery',https://www.lemonde.fr/en/politics/article/2026/07/06/2027-presidential-election-philippe-outlines-moderate-right-wing-vision-for-french-recovery_6755200_5.html,,Subscribers only,https://img.lemde.fr/2026/07/05/0/445/4804/3203/398/265/75/0/6dfbb83_ftp-1-vrpujzcdczd6-5540429-01-06.jpg,,
'What comes next will be just as grueling': Villagers remain anxious after wildfire in southern France,https://www.lemonde.fr/en/environment/article/2026/07/06/what-comes-next-will-be-just-as-grueling-villagers-remain-anxious-after-wildfire-in-southern-france_6755186_114.html,,Subscribers only,https://img.lemde.fr/2026/07/05/0/0/3072/2048/398/265/75/0/4553e20_upload-1-lwc15yaull4s-maxnewsspecialtwo658066.jpg,,
"Netflix, Prime Video and Disney+ challenge new French investment rules",https://www.lemonde.fr/en/economy/article/2026/07/06/netflix-prime-video-and-disney-challenge-new-french-investment-rules_6755196_19.html,"The streaming services filed appeals to contest a new rule that requires them to dedicate 20% of their mandatory investment in French audiovisual content to animation, documentaries and live performance programming.",Subscribers only,https://img.lemde.fr/2026/07/05/46/0/7521/5014/398/265/75/0/21d351a_upload-1-cohzs8jzgige-063-2250243524.jpg,,
Politicial scientist Alexandra de Hoop Scheffer: 'The United States is grappling with strategic saturation',https://www.lemonde.fr/en/international/article/2026/07/06/politicial-scientist-alexandra-de-hoop-scheffer-the-us-is-pursuing-a-strategy-of-strategic-saturation_6755177_4.html,"According to the president of the German Marshall Fund, the US, who is engaged on multiple fronts, is renegotiating the transatlantic contract unilaterally by pressuring its European allies to take responsibility for their own security. This 'burden shifting' challenges Europe to coordinate the organization of its defense industries.",Subscribers only,https://img.lemde.fr/2026/07/02/840/0/2363/1575/398/265/75/0/9462a4d_upload-1-z1lo2v8iepvg-mark-dion-between-voltaire-and-poe-hd-rafaele-fanelli-de-toure-rvb.jpg,,
Pogacar wins Tour de France third stage and takes yellow jersey,https://www.lemonde.fr/en/sports/article/2026/07/06/pogacar-wins-tour-de-france-third-stage-and-takes-yellow-jersey_6755202_9.html,The world champion and rival Jonas Vingegaard are dead level on time.,,https://img.lemde.fr/2026/07/06/27/0/2759/1839/398/265/75/0/4329055_ftp-1-veabwkzfbcds-2026-07-06t151937z-1884145434-up1em7616kovf-rtrmadp-3-cycling-france.JPG,,
Somaliland's high-risk quest for recognition,https://www.lemonde.fr/en/le-monde-africa/visuel/2026/07/06/somaliland-s-high-risk-quest-for-recognition_6755178_124.html,"The self-proclaimed republic aspires to accede to the international stage. It finds itself at the center of a game of alliances, caught between Israeli, American and Emirati ambitions and threats from Yemen and neighboring Somalia.",Subscribers only,https://img.lemde.fr/2026/04/17/0/277/834/556/664/442/75/0/d45b9ef_upload-1-rlyoptcq4o8u-plan-de-travail-3mediaappel2.png,Francesca Fattori and  Noé Hochet-Bodin,Visual Story
Trump confirms he pushed FIFA to review Balogun's red card,https://www.lemonde.fr/en/sports/article/2026/07/06/trump-confirms-he-pushed-fifa-to-review-balogun-s-red-card_6755205_9.html,,,https://img.lemde.fr/2026/07/06/0/2/4476/2984/198/132/95/0/3e64407_ftp-1-uo97xvph1vsf-5549823-01-06.jpg,,
"Frenchman jailed in missing body case confesses to killing wife, says his lawyer",https://www.lemonde.fr/en/france/article/2026/07/06/frenchman-jailed-in-missing-body-case-confesses-to-killing-wife-says-his-lawyer_6755206_7.html,,,https://img.lemde.fr/2026/07/06/0/0/8256/5504/198/132/95/0/06342f3_ftp-1-abziffffoq4k-5548047-01-06.jpg,,
France pulls all diplomats from Burkina Faso,https://www.lemonde.fr/en/burkina-faso/article/2026/07/06/france-pulls-all-diplomats-from-burkina-faso_6755207_222.html,,,https://img.lemde.fr/2026/06/27/0/0/4520/3013/198/132/95/0/7e52c14_ftp-1-r03whnyhro2d-503f4051056f4692a6f31137190b8fca-0-21bb8d05f85b40d7b58fbd452297c4fb.jpg,,
Resigned Le Pen puts on brave face before crucial court decision,https://www.lemonde.fr/en/politics/article/2026/07/06/resigned-le-pen-puts-on-brave-face-before-crucial-court-decision_6755180_5.html,,Subscribers only,https://img.lemde.fr/2026/07/05/0/0/6000/4000/198/132/95/0/0a2a4d1_upload-1-1f6wbilk2qcb-cbi1322016.jpg,,
Hamas says it has dissolved its governing bodies in the Gaza Strip,https://www.lemonde.fr/en/international/article/2026/07/06/hamas-says-it-has-dissolved-its-governing-bodies-in-the-gaza-strip_6755197_4.html,,,,,
Russia launches deadly barrage on Kyiv region on eve of NATO summit,https://www.lemonde.fr/en/international/article/2026/07/06/russia-launches-deadly-barrage-on-kyiv-region-on-eve-of-nato-summit_6755179_4.html,,,,,
Masked gang steal jewels worth millions in French museum burglary,https://www.lemonde.fr/en/france/article/2026/07/06/masked-gang-steal-jewels-worth-millions-in-french-museum-burglary_6755182_7.html,,,,,
French court spoils Bernard Arnault's American weekend,https://www.lemonde.fr/en/economy/article/2026/07/06/french-courts-spoil-bernard-arnault-s-american-weekend_6755193_19.html,,,,,
Philosopher Mélanie Plouviez: 'The rich are not rich alone; they are in a social world that protects them',https://www.lemonde.fr/en/opinion/article/2026/07/05/philosopher-melanie-plouviez-the-rich-are-not-rich-alone-they-are-in-a-social-world-that-protects-them_6755173_23.html,,Subscribers only,,,
You can get good Latin American food in Paris. Here's where,https://www.lemonde.fr/en/food/article/2026/07/05/you-can-get-good-latin-american-food-in-paris-here-s-where_6755168_119.html,,Subscribers only,,,
Ukraine's gas stations are increasingly targeted by Russian drones,https://www.lemonde.fr/en/international/article/2026/07/06/ukraine-s-gas-stations-increasingly-targeted-by-russian-drones_6755204_4.html,,Subscribers only,,,
UAE discreetly builds military base in Somaliland for US and Israel,https://www.lemonde.fr/en/le-monde-africa/article/2026/07/06/uae-discreetly-builds-military-base-in-somaliland-for-us-and-israel_6755184_124.html,,Subscribers only,,,
"'We sacrificed everything': In Nablus, the relentless decline of Palestinian society",https://www.lemonde.fr/en/international/article/2026/07/05/we-sacrificed-everything-in-nablus-the-relentless-decline-of-palestinian-society_6755157_4.html,"In the occupied West Bank, Israel's financial stranglehold on the Palestinian Authority, combined with the proliferation of military checkpoints, has pushed society into unprecedented poverty. In Nablus, the economic heart of the occupied territory, all sectors have faced a sharp decline in living standards.",Subscribers only,https://img.lemde.fr/2026/06/30/463/0/3298/2198/664/442/75/0/7124d9c_upload-1-x6flnj53esn5-ll-naplouse-crise-eco-cisjordanie-50.jpg,Lucien Lung and  Marie Jo Sader,Feature
250 years of American independence: Trump praises US and attacks 'communists' at chaotic celebration,https://www.lemonde.fr/en/international/article/2026/07/05/250-years-of-american-independence-trump-praises-us-and-attacks-communists-at-chaotic-celebration_6755164_4.html,"After over an hour's delay due to a heatwave and thunderstorms, Republican President Donald Trump, who made Independence Day into a celebration of his glory, gave a speech, under the rain, in which he claimed that 'America is back.'",Subscribers only,https://img.lemde.fr/2026/07/05/0/0/3744/2496/664/442/75/0/51855df_ftp-1-fj5f2tnzcg7y-2026-07-05t032802z-1431430238-rc2f7ma6vstp-rtrmadp-3-usa-250-trump.JPG,Nicolas Chapuis,Feature
250 years of American independence: How the text that founded the US – and changed the world – was drafted,https://www.lemonde.fr/en/international/article/2026/06/22/250-years-of-american-independence-how-the-text-that-founded-the-us-and-changed-the-world-was-drafted_6754757_4.html,"'America 250' (1/13). The 13 colonies had been fighting the British Crown for a year when, in July 1776, lawyer Thomas Jefferson completed the drafting of the Declaration of Independence. Adopted by Congress on July 4 in Philadelphia, this document, which established the principle of equality for all – even though slavery was still legal everywhere – founded the United States of America.",Subscribers only,https://img.lemde.fr/2026/06/19/467/0/10121/6747/664/442/75/0/71684ce_upload-1-gu3z5d9wjrsp-episode1-master-pnp-pga-02300-02322u.jpg,Corine Lesnes,Series
Pope Leo XIV's reminder of the duty of humanity toward migrants,https://www.lemonde.fr/en/opinion/article/2026/07/06/pope-leo-xiv-s-reminder-of-the-duty-of-humanity-toward-migrants_6755201_23.html,,,,Le Monde,Editorial
Climate change: 'We cannot meet the challenge of adapting housing with the tools of the past. A thorough overhaul is needed',https://www.lemonde.fr/en/economy/article/2026/07/04/climate-change-we-cannot-meet-the-challenge-of-adapting-housing-with-the-tools-of-the-past-a-thorough-overhaul-is-needed_6755153_19.html,,Subscribe,,Emeline Cazi,Interview
"Timothy Snyder, historian: 'Trump's war against Iran shows that evil and folly can march hand in hand'",https://www.lemonde.fr/en/opinion/article/2026/07/03/timothy-snyder-historian-trump-s-war-against-iran-shows-that-evil-and-folly-can-march-hand-in-hand_6755112_23.html,,Subscribe,,Timothy Snyder,Op-Ed
