title,href,subhead,premium,image,byline,type
'We are walking a fine line': Incurably ill patients on France's new assisted-dying law,https://www.lemonde.fr/en/france/article/2026/07/15/we-are-walking-a-fine-line-incurably-ill-patients-on-france-s-assisted-dying-bill_6755497_7.html,A law creating a right to aid in dying was adopted by French lawamkers on Wednesday. Le Monde spoke with people facing serious illness about how the choice weighs on their lives.,Subscribers only,https://img.lemde.fr/2026/07/13/0/0/4999/3333/400/266/75/0/d779697_upload-1-he9yuzyyibrp-pch0100015.jpg,,
French parliament adopts assisted dying law supported by Macron,https://www.lemonde.fr/en/france/article/2026/07/15/french-parliament-adopts-assisted-dying-law-supported-by-macron_6755509_7.html,,,https://img.lemde.fr/2026/07/15/0/0/5956/3970/398/265/75/0/2c50edc_ftp-1-vgzyh9hb50di-2026-07-15t173124z-1709054638-rc2hemavb74z-rtrmadp-3-france-politics-assisted-dying.JPG,,
"France facing 'very worrying' drought, says environment minister",https://www.lemonde.fr/en/france/article/2026/07/15/france-facing-very-worrying-drought-says-environment-minister_6755499_7.html,,,https://img.lemde.fr/2026/07/11/0/0/12288/8192/398/265/75/0/95603dc_ftp-1-hy1ezxw85cy5-5593471-01-06.jpg,,
"René Obermann, chairman of Airbus: 'We must put an end to industrial nationalism in defense'",https://www.lemonde.fr/en/economy/article/2026/07/15/rene-obermann-chairman-of-airbus-we-must-put-an-end-to-industrial-nationalism-in-defense_6755496_19.html,"In an interview with Le Monde and Frankfurter Allgemeine Zeitung, the chair of the board of the European aerospace and defense group expressed concern about the future of French-German cooperation, which has been undermined by the cancellation in June of the FCAS, the next-generation fighter jet project.",Subscribers only,https://img.lemde.fr/2026/07/14/1112/0/5212/3474/398/265/75/0/7180d37_upload-1-bxjblp8gwwxf-rea10590784.jpg,,
Journalist Ali Lmrabet awaits possible trial in Morocco: 'I am accused of defaming the head of police and the king's chief adviser',https://www.lemonde.fr/en/le-monde-africa/article/2026/07/15/journalist-ali-lmrabet-awaits-possible-trial-in-morocco-i-am-accused-of-defaming-the-head-of-police-and-the-king-s-chief-adviser_6755507_124.html,The French-Moroccan journalist was released from police custody on Wednesday following his arrest in Tangier on Sunday for 'the publication of defamatory and insulting digital content.',Subscribers only,https://img.lemde.fr/2026/07/13/0/0/3808/2539/398/265/75/0/9f4b143_ftp-1-uvdzmqojpgw4-5610424-01-06.jpg,,
Tour de France: Waerenskjold wins fastest ever stage,https://www.lemonde.fr/en/sports/article/2026/07/15/tour-de-france-waerenskjold-wins-fastest-ever-stage_6755504_9.html,The Norwegian launched a long-range sprint to claim victory in Nevers.,,https://img.lemde.fr/2026/07/15/0/0/5311/3540/398/265/75/0/623b212_ftp-1-w7nzovb7gy99-5628331-01-06.jpg,,
2026 World Cup: How France's American dream built up speed – and crashed,https://www.lemonde.fr/en/sports/article/2026/07/15/2026-world-cup-how-france-s-american-dream-built-up-speed-and-crashed_6755503_9.html,"France fell hard to Spain on Tuesday in the semifinals of the football tournament, marking a cruel and unexpected ending for Didier Deschamps' squad, who had delighted supporters since the start of the competition.",Subscribers only,https://img.lemde.fr/2026/07/14/0/0/3511/2341/664/442/75/0/9b3b29f_ftp-1-jwxcbxzawtut-83010e8ceebb4ed6ad778069e6da5beb-1-ab8db5bd79784b98b15e428f0ebe3548.jpg,Alexandre Lemarié and  Denis Ménétrier,In Depth
Ukraine's defense minister resigns as part of reshuffle,https://www.lemonde.fr/en/international/article/2026/07/15/ukraine-s-defense-minister-resigns-as-part-of-reshuffle_6755511_4.html,,,https://img.lemde.fr/2026/07/15/0/0/4383/2922/198/132/95/0/a2e6428_ftp-1-mzty4b38jnj9-2026-07-15t192242z-774889553-rc2w4marbeuj-rtrmadp-3-ukraine-crisis-government-fedorov.JPG,,
Elon Musk says far-right Marine Le Pen is 'France's last hope',https://www.lemonde.fr/en/politics/article/2026/07/15/elon-musk-says-far-right-marine-le-pen-is-france-s-last-hope_6755506_5.html,,,https://img.lemde.fr/2026/07/15/0/0/5574/3716/198/132/95/0/b9828c1_ftp-1-ahcm29zpug4l-2026-07-15t145353z-1747129613-rc2eema0bgeo-rtrmadp-3-france-politics.JPG,,
French justice minister vows action on child sex-abuse cases after death of 11-year-old Lyhanna,https://www.lemonde.fr/en/france/article/2026/07/15/french-justice-minister-vows-action-on-child-sex-abuse-cases-after-death-of-11-year-old-lyhanna_6755510_7.html,,,https://img.lemde.fr/2026/07/15/0/0/5811/3874/198/132/95/0/cb1e3a2_ftp-1-pdxsidy93qy1-5629827-01-06.jpg,,
"Six women accuse French ex-model boss Gérald Marie of rape, human trafficking",https://www.lemonde.fr/en/france/article/2026/07/15/six-women-accuse-french-ex-model-boss-gerald-marie-of-rape-human-trafficking_6755508_7.html,,,https://img.lemde.fr/2026/07/15/401/0/1883/1255/198/132/95/0/02d5bca_upload-1-lzmijjpj9jpg-02d5bca-upload-1-5arl7jj1agcr-2009-09-17t120000z-1685536743-pm1e59g1pby01-rtrmadp-3-france.JPG,,
US targets ICC in new offensive,https://www.lemonde.fr/en/international/article/2026/07/15/the-international-criminal-court-targeted-by-a-new-us-offensive_6755477_4.html,,Subscribers only,,,
"In Fontainebleau, southern France firefighters share expertise with Paris-region colleagues",https://www.lemonde.fr/en/environment/article/2026/07/14/in-fontainebleau-southern-france-firefighters-share-expertise-with-paris-region-colleagues_6755472_114.html,,Subscribers only,,,
Why France's national weather service struggles to accurately predict heatwaves,https://www.lemonde.fr/en/environment/article/2026/07/15/why-france-s-national-weather-service-struggles-to-give-accurate-heatwave-predictions_6755478_114.html,,Subscribers only,,,
"From Paris to Nice, Macron marks his final Bastille Day with a series of commemorations",https://www.lemonde.fr/en/politics/article/2026/07/15/from-paris-to-nice-emmanuel-macron-marks-bastille-day-with-a-series-of-commemorations_6755481_5.html,,Subscribers only,,,
"Ukraine expands attacks in Sea of Azov, a crucial maritime corridor for Russia",https://www.lemonde.fr/en/international/article/2026/07/15/ukraine-expands-attacks-to-the-sea-of-azov-a-crucial-maritime-corridor-for-russia_6755475_4.html,,Subscribers only,,,
Wildfires that ravaged historic Fontainebleau forest outside Paris 'contained',https://www.lemonde.fr/en/france/article/2026/07/14/wildfires-continue-to-ravage-fontainebleau-forest-as-france-marks-bastille-day_6755458_7.html,,,,,
Spain picks apart Mbappé's powerless France in World Cup semi-final,https://www.lemonde.fr/en/sports/article/2026/07/15/spain-picks-apart-mbappe-s-powerless-france-in-world-cup-semi-final_6755488_9.html,,Subscribers only,,,
Spanish ex-PM Rajoy refuses to back down from racist remark on French football team,https://www.lemonde.fr/en/international/article/2026/07/15/spanish-ex-pm-rajoy-refuses-to-back-down-from-racist-france-football-team-remark_6755493_4.html,,,,,
"'Thank you, dear Hungary, for proving that anything is always possible'",https://www.lemonde.fr/en/international/article/2026/07/13/thank-you-dear-hungary-for-proving-that-anything-is-always-possible_6755431_4.html,"Jean-Baptiste Chastand, Le Monde's Central Europe correspondent, writes a letter to this 'hostile and surprising' country he has covered for more than 10 years.",Subscribers only,https://img.lemde.fr/2026/04/12/0/0/4000/2666/664/442/75/0/ca3f557_ftp-1-bdzqby4rsttp-7ff5295e6b4342188037076ad01d97db-0-24a67f843e9d40f58fd1322214819d6e.jpg,Jean-Baptiste Chastand,Letter from...
Visualize the full extent of wildfires across Europe in recent weeks,https://www.lemonde.fr/en/les-decodeurs/article/2026/07/14/visualize-the-full-extent-of-wildfires-across-europe-in-recent-weeks_6755451_8.html,The burned areas across the European continent have already far surpassed levels seen in recent years and are now approaching the maximum recorded in 2025.,Subscribers only,https://img.lemde.fr/2026/07/10/0/0/3840/2560/664/442/75/0/f3c2a33_upload-1-pzmr8dmczv5t-media-d-appel-light.png,Pierre Breteau,In Graphs
"'You're expected to perform, but no one wants to know how you do it': Cocaine, the toxic fuel of young professionals",https://www.lemonde.fr/en/campus/article/2026/07/11/you-re-expected-to-perform-but-no-one-wants-to-know-how-you-do-it-cocaine-the-toxic-fuel-of-young-professionals_6755382_11.html,"Cocaine at work (1/3). Among young professionals, the illegal and highly addictive drug is used in a relentless pursuit of performance, often shrouded in taboo and without questioning of working conditions.",Subscribers only,https://img.lemde.fr/2026/06/26/19/0/2244/1496/664/442/75/0/a56b4a1_upload-1-ipxiw8h7o5we-01-hd.jpg,Marine Miller,Series
Iran and US slide back into dead end of war,https://www.lemonde.fr/en/opinion/article/2026/07/15/iran-and-us-slide-back-into-dead-end-of-war_6755492_23.html,,,,Le Monde,Editorial
French MPs' vote to establish presumption of legitimate defense for police sets dangerous precedent,https://www.lemonde.fr/en/opinion/article/2026/07/12/french-mps-vote-to-establish-presumption-of-legitimate-defense-for-police-sets-dangerous-precedent_6755413_23.html,,,,Le Monde,Editorial
'No region is safe from climate change: Brittany will not be a climate refuge',https://www.lemonde.fr/en/opinion/article/2026/07/12/no-region-is-safe-from-climate-change-brittany-will-not-be-a-climate-refuge_6755386_23.html,,Subscribe,,Antoine Poincaré  and  Clément Jeanneau,Op-Ed
