title,href,subhead,premium,image,byline,type
"Inside the court of France's richest man, Bernard Arnault",https://www.lemonde.fr/en/summer-reads/article/2026/07/19/bernard-arnault-inside-the-court-of-france-s-richest-man_6755617_183.html,'Bernard Arnault's Empire' (1/6). The billionaire at the head of LVMH is as secretive as he is powerful. He relies on a devoted entourage in which a mix of fear and admiration prevails.,Subscribers only,https://img.lemde.fr/2026/07/16/1736/0/4000/2666/400/266/75/0/3630522_upload-1-tarby5yocvaj-l1070311.jpg,,
Didier Deschamps bids farewell to French team after spectacular World Cup defeat,https://www.lemonde.fr/en/sports/article/2026/07/19/didier-deschamps-bids-farewell-to-france-after-spectacular-world-cup-defeat_6755623_9.html,,Subscribers only,https://img.lemde.fr/2026/07/18/37/0/3679/2452/398/265/75/0/fc58451_ftp-1-tlhekyapopam-2026-07-18t230859z-1513324500-up1em7i1saxql-rtrmadp-3-soccer-worldcup-fra-eng.JPG,,
'Can we continue to entrust global sport to organizations more concerned with their financial interests than with the public good?',https://www.lemonde.fr/en/opinion/article/2026/07/19/can-we-continue-to-entrust-global-sport-to-organizations-more-concerned-with-their-financial-interests-than-with-the-public-good_6755619_23.html,,Subscribers only,https://img.lemde.fr/2026/06/26/0/0/1500/1000/398/265/75/0/fbaed81_upload-1-jmitx2xp6sco-frame-1468.jpg,,
Rubio hails Lebanon for peace efforts after meeting president,https://www.lemonde.fr/en/international/article/2026/07/19/rubio-hails-lebanon-for-peace-efforts-after-meeting-president_6755631_4.html,"US Secretary of State Marco Rubio commended the Lebanese government for its 'determined effort to reclaim Lebanon's sovereignty, disarm Hezbollah and dismantle its terrorist infrastructure, and move towards peace.'",,https://img.lemde.fr/2026/07/16/0/1/5997/3998/398/265/75/0/3c481ef_ftp-1-ho3leooxyw6x-5638302-01-06.jpg,,
An organic farmer's dismay at the speed of climate change: 'I thought I would have time to prepare',https://www.lemonde.fr/en/economy/article/2026/07/19/an-organic-farmer-s-dismay-at-the-speed-of-climate-change-i-thought-i-would-have-time-to-prepare_6755633_19.html,"Late frosts, cold springs and repeated heatwaves: Climate hazards now accumulate within a single season, disrupting crops and undermining the livelihoods of vegetable growers who already earn little. Even farms practicing organic agriculture, which are committed to adaptation, are struggling to cope.",Subscribers only,https://img.lemde.fr/2026/07/15/0/0/8256/5504/398/265/75/0/6c30aeb_upload-1-3parwo9gkkzr-dsc-006.jpg,,
Floating igloo leaves France for polar exploration mission,https://www.lemonde.fr/en/france/article/2026/07/19/floating-igloo-leaves-france-for-polar-exploration-mission_6755632_7.html,"The Tara Polar Station set out from France on Sunday to begin a long-term mission to study biodiversity in the Arctic. The floating laboratory, shaped like an igloo, is designed to withstand sea-ice pressure and to endure temperatures as low as -52º.",,https://img.lemde.fr/2026/06/26/10/0/3832/2554/398/265/75/0/f6b5e1b_ftp-1-0vb1raplk3ft-2026-06-26t081746z-1000012603-rc2d2kalm0et-rtrmadp-3-arctic-security-nato.JPG,,
"20 men, a 'sperm party,' and two days of sexual torment: The brutality of the 'libertine' rapes case",https://www.lemonde.fr/en/france/article/2026/07/19/20-men-a-sperm-party-and-two-days-of-sexual-torment-the-brutality-of-the-libertine-rapes-case_6755622_7.html,"Over the course of a long weekend, one of Christophe B.'s former partners was forced to endure sexual assaults by numerous men at their home. Some of these assaults were broadcast live on the swinging website Wyylde.",Subscribers only,https://img.lemde.fr/2026/07/14/0/0/6378/4252/664/442/75/0/19c6859_upload-1-hofmwkipna9e-bordeaux-viol-3-def.jpg,Jérôme Lefilliâtre and  Lorraine de Foucher,Investigation
"Gaza's children, traumatized and mutilated by war: 'His prosthesis hurts, but he endures it to show that he isn't different'",https://www.lemonde.fr/en/international/article/2026/07/19/gaza-s-children-traumatized-and-mutilated-by-war-his-prosthesis-hurts-but-he-endures-it-to-show-that-he-isn-t-different_6755626_4.html,,Subscribers only,https://img.lemde.fr/2026/07/02/1/0/8192/5461/198/132/95/0/3e644af_upload-1-wjfiu9hf8ewr-af4a3227.JPG,,
"The forest's slow return after fires: 'It feels like all life is gone, but in reality, much remains'",https://www.lemonde.fr/en/environment/article/2026/07/19/the-forest-s-slow-return-after-fires-it-feels-like-all-life-is-gone-but-in-reality-much-remains_6755629_114.html,,Subscribers only,https://img.lemde.fr/2026/07/16/0/0/6192/4128/198/132/95/0/d4b8c63_upload-1-waj3kg4bzmnn-incendie-en-foret-de-fontainebleau-44.jpg,,
Olympic champion Evenepoel wins Tour de France 15th stage,https://www.lemonde.fr/en/sports/article/2026/07/19/olympic-champion-evenepoel-wins-tour-de-france-15th-stage_6755630_9.html,,,https://img.lemde.fr/2026/07/19/0/0/6271/4181/198/132/95/0/d2d0b9d_ftp-1-wnnleadjfw8o-5658176-01-06.jpg,,
"Alexander Skarsgård, a daring actor",https://www.lemonde.fr/en/m-le-mag/article/2026/07/19/alexander-skarsgard-a-daring-actor_6755628_117.html,,Subscribers only,https://img.lemde.fr/2026/02/17/156/0/1500/1000/198/132/95/0/be30188_ftp-1-r0ia71hurfku-416941-3459171.jpg,,
Is the Bible terrifying? Three frightening stories from the holy book,https://www.lemonde.fr/en/religions/article/2026/07/19/is-the-bible-terrifying-three-frightening-stories-from-the-holy-book_6755627_63.html,,Subscribers only,,,
'Netanyahu still regards the 1946 King David Hotel bombers in Jerusalem as heroes',https://www.lemonde.fr/en/international/article/2026/07/19/netanyahu-still-regards-the-1946-king-david-hotel-bombers-in-jerusalem-as-heroes_6755625_4.html,,Subscribers only,,,
France commemorates Vél d'Hiv roundup after Paris plaque honoring rescuers is vandalized,https://www.lemonde.fr/en/france/article/2026/07/19/france-commemorates-vel-d-hiv-roundup-after-paris-plaque-honoring-rescuers-is-vandalized_6755624_7.html,,,,,
England beat France 6-4 in chaotic World Cup bronze match,https://www.lemonde.fr/en/sports/article/2026/07/19/england-beat-france-6-4-in-chaotic-world-cup-bronze-match_6755612_9.html,,,,,
"BTS electrifies Stade de France, seven years after their last Paris concert",https://www.lemonde.fr/en/culture/article/2026/07/19/bts-electrifies-stade-de-france-seven-years-after-their-last-paris-concert_6755618_30.html,,Subscribers only,,,
"In a world in turmoil, 'Hamlet' has never been more relevant",https://www.lemonde.fr/en/opinion/article/2026/07/19/in-a-world-in-turmoil-hamlet-has-never-been-more-relevant_6755613_23.html,,Subscribers only,,,
France's must-see art exhibitions this summer,https://www.lemonde.fr/en/culture/article/2026/07/19/france-s-must-see-art-exhibitions-this-summer_6755615_30.html,,Subscribers only,,,
Trump faces pressure to escalate in Iran after deaths of two US soldiers,https://www.lemonde.fr/en/international/article/2026/07/19/trump-faces-pressure-to-escalate-in-iran-after-deaths-of-two-us-soldiers_6755621_4.html,,Subscribers only,,,
War is undermining social contract between Putin and Russians,https://www.lemonde.fr/en/international/article/2026/07/19/war-is-undermining-social-contract-between-putin-and-russians_6755611_4.html,"The spread of Ukrainian attacks across the country is deepening Russians' concerns about the regime's ability to protect their basic needs, as the economic situation deteriorates.",Subscribers only,https://img.lemde.fr/2026/07/10/0/0/7788/5192/664/442/75/0/cfc86c6_ftp-1-i27ny47kipey-5585549-01-06.jpg,Benjamin Quénelle and  Marie Jégo,In Depth
19 men charged in mass rapes case among 'libertines' in France,https://www.lemonde.fr/en/france/article/2026/07/17/19-men-charged-in-mass-rapes-case-among-libertines-in-france_6755571_7.html,"A man identified as Christophe B. is accused of having forced six former partners into extremely violent sexual encounters with dozens of men recruited online over a period of more than 20 years, under the guise of 'libertinism.'",Subscribers only,https://img.lemde.fr/2026/07/14/1807/0/4252/2834/664/442/75/0/0aa5ac5_upload-1-kt230soit05h-bordeaux-viol-1-def.jpg,Jérôme Lefilliâtre and  Lorraine de Foucher,Investigation
Bayeux Tapestry arrives in London for forthcoming display at British Museum,https://www.lemonde.fr/en/culture/article/2026/07/18/bayeux-tapestry-arrives-in-london-for-forthcoming-display-at-british-museum_6755599_30.html,"The thousand-year-old, 70-meter-long embroidery depicting William the Conqueror's exploits in medieval England has been removed from its crate after its transfer from France. Staff will begin a thorough check of its condition on Monday, and it will be placed in a custom-made display case a few days later.",Subscribers only,https://img.lemde.fr/2026/07/17/0/0/6970/4647/664/442/75/0/207a6a9_ftp-1-n5sighl6yh5u-5644140-01-06.jpg,Roxana Azimi,Feature
Donald Trump and his troubling electoral obsessions,https://www.lemonde.fr/en/opinion/article/2026/07/18/donald-trump-and-his-troubling-electoral-obsessions_6755603_23.html,,,,Le Monde,Editorial
"'We are trapped in a climate dystopia, a black comedy scenario, where the grotesque rivals the Orwellian farce'",https://www.lemonde.fr/en/opinion/article/2026/07/18/we-are-trapped-in-a-climate-dystopia-a-black-comedy-scenario-where-the-grotesque-rivals-the-orwellian-farce_6755609_23.html,,Subscribe,,Stéphane Foucart,Column
Iran and US slide back into dead end of war,https://www.lemonde.fr/en/opinion/article/2026/07/15/iran-and-us-slide-back-into-dead-end-of-war_6755492_23.html,,,,Le Monde,Editorial
