title,href,subhead,premium,image,byline,type
"'If they catch me, it's over for me': Senegal's LGBTQ+ community lives in daily fear of repression",https://www.lemonde.fr/en/international/article/2026/07/12/if-they-catch-me-it-s-over-for-me-senegal-s-lgbtq-community-lives-in-daily-fear-of-repression_6755411_4.html,"In March, Senegal passed a law increasing penalties for same-sex relations, leaving LGBTQ+ people living in fear. Several described their deeply uncertain daily lives, gripped by the constant anxiety of being arrested.",Subscribers only,https://img.lemde.fr/2026/07/05/0/0/2835/1890/400/266/75/0/ee0a4f8_upload-1-jy1nfkgf4rxv-img-9690.jpeg,,
'We were meant to take as many jewels as we could': The confessions of two Louvre burglars,https://www.lemonde.fr/en/france/article/2026/07/12/we-were-meant-to-take-as-many-jewels-as-we-could-the-confessions-of-two-louvre-burglars_6755398_7.html,,Subscribers only,https://img.lemde.fr/2026/07/11/0/93/7722/5148/398/265/75/0/2a52031_upload-1-h1iiu0yszurt-000-79ar7mw.jpg,,
'It would have been enough to learn the terrible lessons from Gaza to anticipate the current impasse over Iran',https://www.lemonde.fr/en/international/article/2026/07/12/it-would-have-been-enough-to-learn-the-terrible-lessons-from-gaza-to-anticipate-the-current-impasse-over-iran_6755416_4.html,,Subscribers only,https://img.lemde.fr/2026/06/17/333/0/5000/3333/398/265/75/0/3092298_upload-1-ugwdpc5o1fmq-kzihnioglu-evian-g7-16062026-22.jpg,,
Alfred Dreyfus statue finally finds place in heart of Paris,https://www.lemonde.fr/en/politics/article/2026/07/12/alfred-dreyfus-statue-finally-finds-place-in-heart-of-paris_6755409_5.html,"The bronze sculpture created by the artist Tim in 1985 was installed in front of the Cour de Cassation, the court that eventually cleared Dreyfus's name.",Subscribers only,https://img.lemde.fr/2026/07/12/0/0/7854/5236/398/265/75/0/5ee3c9f_ftp-1-41ddme0f4fpz-84d0a76144604a84b75435276dd43be3-0-ef90be30fa734c10acb7a890957753ba.jpg,,
"'I would do a line before service, hidden in the bathroom': How cocaine is flooding the restaurant industry",https://www.lemonde.fr/en/campus/article/2026/07/12/i-would-do-a-line-before-service-hidden-in-the-bathroom-how-cocaine-is-flooding-the-restaurant-industry_6755405_11.html,"Cocaine at work (2/3). From fast-food joints to Michelin-starred restaurants, drug use has become as commonplace as it is alarming in an industry driven by the pursuit of performance, a toxic party culture and grueling working conditions.",Subscribers only,https://img.lemde.fr/2026/06/29/64/68/2123/1415/398/265/75/0/fa5a5a0_upload-1-3mb3abetffat-02-hd-1.jpg,,
Sinner outlasts Zverev to win second straight Wimbledon title,https://www.lemonde.fr/en/sports/article/2026/07/12/sinner-outlasts-zverev-to-win-second-straight-wimbledon-title_6755415_9.html,"24-year-old Jannik Sinner wore down French Open champion Alexander Zverev, securing a 6-7 (7/9), 7-6 (7/2), 6-3, 6-4 win on Sunday. 'You never know how many times you are going to come back,' said the world No. 1. 'I never take it for granted.'",,https://img.lemde.fr/2026/07/12/0/0/7791/5194/398/265/75/0/917f9df_ftp-1-tduvfy6gemrp-5606005-01-06.jpg,,
"French heatwave drives up water consumption, puts supply networks under severe strain",https://www.lemonde.fr/en/environment/article/2026/07/13/french-heatwave-drives-up-water-consumption-puts-supply-networks-under-severe-strain_6755418_114.html,"Water usage rose by 10% to 50% in June compared to the same period in 2025, forcing already fragile infrastructure to operate at full capacity, while underground reserves and rivers weakened.",Subscribers only,https://img.lemde.fr/2026/05/25/100/0/5400/3600/664/442/75/0/3d87080_ftp-1-d6gwae9knbpu-2026-05-25t154150z-943602607-up1em5p17lpwc-rtrmadp-3-tennis-frenchopen.JPG,Léa Sanchez,In Depth
Massive fire in Bangkok bar kills at least 27,https://www.lemonde.fr/en/international/article/2026/07/13/massive-fire-in-bangkok-bar-kills-at-least-27_6755420_4.html,,,https://img.lemde.fr/2026/07/12/0/0/7237/4824/198/132/95/0/ceff6af_ftp-1-1gkj3lr58fdi-5606732-01-06.jpg,,
Major fire rages in Fontainebleau forest near Paris,https://www.lemonde.fr/en/environment/article/2026/07/13/major-fire-rages-in-fontainebleau-forest-near-paris_6755419_114.html,,,https://img.lemde.fr/2026/07/12/0/1/3568/2379/198/132/95/0/44b8f57_ftp-1-nqegnfhoxfcz-5607105-01-06.jpg,,
Spanish PM Sanchez condemns predecessor's racist remarks on French football team,https://www.lemonde.fr/en/international/article/2026/07/12/spanish-pm-sanchez-condemns-predecessor-s-racist-remarks-on-french-football-team_6755407_4.html,,,https://img.lemde.fr/2026/07/08/5/0/3205/2136/198/132/95/0/76aa85c_ftp-1-un9mbyk8w3aq-2026-07-08t101319z-366680182-rc2m9maxsskf-rtrmadp-3-nato-summit.JPG,,
"'I would do a line before service, hidden in the bathroom': How cocaine is flooding the restaurant industry",https://www.lemonde.fr/en/campus/article/2026/07/12/i-would-do-a-line-before-service-hidden-in-the-bathroom-how-cocaine-is-flooding-the-restaurant-industry_6755405_11.html,,Subscribers only,https://img.lemde.fr/2026/06/29/64/68/2123/1415/198/132/95/0/fa5a5a0_upload-1-3mb3abetffat-02-hd-1.jpg,,
"Iran declares Hormuz strait closed, US military insists traffic flowing",https://www.lemonde.fr/en/international/article/2026/07/12/iran-announces-closure-of-the-strait-of-hormuz-until-further-notice_6755387_4.html,,,,,
Evacuees allowed to return home after deadly wildfire in Spain stabilizes,https://www.lemonde.fr/en/environment/article/2026/07/12/evacuees-allowed-to-return-home-after-deadly-wildfire-in-spain-stabilizes_6755417_114.html,,,,,
Macron's tribute to Alfred Dreyfus: 'Dreyfusism reminds us that antisemitism is the enemy of the Republic',https://www.lemonde.fr/en/politics/article/2026/07/12/macron-s-tribute-to-alfred-dreyfus-dreyfusism-reminds-us-that-antisemitism-is-the-enemy-of-the-republic_6755403_5.html,,,,,
"Lindsey Graham, Republican hawk who became staunch Trump loyalist, has died",https://www.lemonde.fr/en/obituaries/article/2026/07/12/lindsey-graham-republican-hawk-who-became-staunch-trump-loyalist-has-died_6755397_15.html,,Subscribers only,,,
The rush to air-conditioned spaces: 'Full house at the cinema for 2 hours and 40 minutes of AC',https://www.lemonde.fr/en/m-le-mag/article/2026/07/12/the-rush-to-air-conditioned-spaces-full-house-at-the-cinema-for-2-hours-and-40-minutes-of-ac_6755399_117.html,,Subscribers only,,,
Kyiv spends sleepless nights underground as Russia intensifies attacks,https://www.lemonde.fr/en/international/article/2026/07/11/war-in-ukraine-kyiv-spends-sleepless-nights-underground-as-russia-intensifies-attacks_6755371_4.html,,Subscribers only,,,
French women's baseballers 'not going to give up' after national team is shut down,https://www.lemonde.fr/en/france/article/2026/07/12/french-women-s-baseballers-not-going-to-give-up-after-national-team-is-shut-down_6755410_7.html,,Subscribers only,,,
French prosecutors open terror probe after guns found in car near Paris,https://www.lemonde.fr/en/france/article/2026/07/12/french-prosecutors-open-terror-probe-after-guns-found-in-car-near-paris_6755412_7.html,,,,,
"Simon Abkarian, star of 'De Gaulle': 'At school in Lebanon, my nickname was de Gaulle'",https://www.lemonde.fr/en/culture/article/2026/07/12/simon-abkarian-star-of-de-gaulle-at-school-in-lebanon-my-nickname-was-de-gaulle_6755408_30.html,"The actor and theater director plays Charles de Gaulle in the recently released two-part film. In this article, he explains how he prepared for the role of France's World War II hero.",Subscribers only,https://img.lemde.fr/2026/04/28/0/0/1600/1066/664/442/75/0/7cd0913_upload-1-tseky6tqpj0e-dg-ma-01258-photo-by-malgosia-abramowska-preview.jpg,Simon Abkarian,Long Read
"Martine Barrat, a photographer without fear or limits",https://www.lemonde.fr/en/m-le-mag/article/2026/07/12/martine-barrat-a-photographer-without-fear-or-limits_6755391_117.html,"At 93, the artist has lost none of her vitality or curiosity. She lives at the legendary Hotel Chelsea in New York, where she remains one of the last year-round artist residents. Today, her work is the subject of a retrospective at the Rencontres d'Arles photography festival.",Subscribers only,https://img.lemde.fr/2026/06/30/382/0/1200/800/664/442/75/0/509e5ca_ftp-1-hbcbynanjmsm-434309-3480713.jpg,Emmanuelle Lequeux,Conversation
"Pauline Vilain-Carlotti, geographer: 'The intensity of wildfires, which seems unprecedented, could become the new norm'",https://www.lemonde.fr/en/opinion/article/2026/07/12/pauline-vilain-carlotti-geographer-the-intensity-of-wildfires-which-seems-unprecedented-could-become-the-new-norm_6755401_23.html,"In an interview with Le Monde, the environmental management specialist says wildfire risks, until now mainly limited to the Mediterranean region, are likely to increase and spread across France.",Subscribers only,https://img.lemde.fr/2026/07/06/0/0/6000/4000/664/442/75/0/f552bda_ftp-1-knei5hurwwbq-5546422-01-06.jpg,David Heck,Interview
French MPs' vote to establish presumption of legitimate defense for police sets dangerous precedent,https://www.lemonde.fr/en/opinion/article/2026/07/12/french-mps-vote-to-establish-presumption-of-legitimate-defense-for-police-sets-dangerous-precedent_6755413_23.html,,,,Le Monde,Editorial
"'Diverse France, that of Kylian Mbappé and the national team, is too promising a reality to be used as an electoral punching bag'",https://www.lemonde.fr/en/opinion/article/2026/07/05/diverse-france-that-of-kylian-mbappe-and-the-national-team-is-too-promising-a-reality-to-be-used-as-an-electoral-punching-bag_6755175_23.html,,Subscribe,https://img.lemde.fr/2025/02/13/0/0/0/0/100/100/60/0/e49d71b_sirius-fs-upload-1-hfccvvna5map-1739442970267-capture-da-a-cran-2025-02-13-113500.png,Philippe Bernard,Column
Populists' temptation of impunity,https://www.lemonde.fr/en/opinion/article/2026/07/09/populists-temptation-of-impunity_6755308_23.html,,,,Le Monde,Editorial
