title,href,subhead,premium,image,byline,type
"Bernard Arnault, generous patron of the arts and lover of tax breaks",https://www.lemonde.fr/en/summer-reads/article/2026/07/23/bernard-arnault-generous-patron-of-the-arts-and-lover-of-tax-breaks_6755771_183.html,"'Bernard Arnault's Empire' (5/6). France's richest man is also one of Europe's leading art collectors. Through the Fondation Louis Vuitton, he combines his passion for the arts with highly lucrative tax arrangements.",Subscribers only,https://img.lemde.fr/2026/07/16/1594/0/3444/2296/400/266/75/0/f00bfc4_upload-1-x8wa9jdfo2ik-rv-45859-15.jpg,,
"European Commission fines Google €890 million, risking Trump's ire",https://www.lemonde.fr/en/economy/article/2026/07/23/european-commission-fines-google-890-million-risking-trump-s-ire_6755767_19.html,,Subscribers only,https://img.lemde.fr/2026/07/23/0/0/7637/5091/398/265/75/0/9c9672e_ftp-1-y9nzn3acsrt5-259e6fe5a98c4ad3ab3559f134cc140e-0-7f7ae18857294b35b08439f2a96b8fe9.jpg,,
"In the West Bank, a Palestinian hamlet faces relentless harassment by settlers",https://www.lemonde.fr/en/international/article/2026/07/23/in-the-west-bank-a-palestinian-hamlet-faces-relentless-harassment-by-settlers_6755770_4.html,,Subscribers only,https://img.lemde.fr/2026/07/06/240/0/5760/3840/398/265/75/0/2b495ef_upload-1-zxlooifbqysg-lgeai-routes-colonisation-6.jpg,,
"Trump threatens Iran with escalation, including strikes on civilian and nuclear infrastructure",https://www.lemonde.fr/en/international/article/2026/07/23/trump-threatens-iran-with-escalation-including-strikes-on-civilian-and-nuclear-infrastructure_6755752_4.html,"After two weeks of strikes on Iran that yielded no progress, US President Donald Trump raised the possibility of targeting uranium enrichment sites beneath the Kolang mountain in central Iran.",Subscribers only,https://img.lemde.fr/2026/07/22/16/0/8855/5903/398/265/75/0/8be753e_upload-1-dejcitfvzvmh-000-b8uz79g.jpeg,,
Fields medal awarded to four young mathematicians,https://www.lemonde.fr/en/international/article/2026/07/23/fields-medal-awarded-to-four-young-mathematicians_6755774_4.html,"Recognized as the Nobel Prize in mathematics, the Fields medal honors researchers under the age of 40 for outstanding discoveries. Of the four recipients, one winner, 35-year-old Hong Wang, is only the third woman to receive the honor since its inception in 1936.",,https://img.lemde.fr/2026/07/23/0/0/3600/2400/398/265/75/0/51e0d6d_ftp-1-gwnyyxpyezf7-5690404-01-06.jpg,,
Chanel's XXL cruise ship in May 2018,https://www.lemonde.fr/en/summer-reads/article/2026/07/23/chanel-s-xxl-cruise-ship-in-may-2018_6755775_183.html,"'Behind the scene' (2/6). Fashion houses often use runway shows as opportunities for particularly spectacular set designs. In May 2018, Karl Lagerfeld docked a life-size cruise ship under the glass dome of the Grand Palais in Paris for Chanel's cruise collection show.",Subscribers only,https://img.lemde.fr/2026/07/07/107/0/1600/1066/398/265/75/0/8501521_upload-1-b0prgu0iz94a-774-decor-show-012-preview.jpg,,
The mysterious horse-shaped geoglyph England has been maintaining for thousands of years,https://www.lemonde.fr/en/m-le-mag/article/2026/07/23/the-mysterious-horse-shaped-geoglyph-england-has-been-maintaining-for-thousands-of-years_6755772_117.html,"The Uffington White Horse is one of the best known geoglyphs in the UK. Drawn around 3,000 years ago on a hillside in Oxfordshire, its chalk outline is maintained each year by volunteers through a restoration campaign.",Subscribers only,https://img.lemde.fr/2026/07/13/0/0/1500/1000/664/442/75/0/dd7ada1_ftp-1-d233m5fmaods-435995-3489729.jpg,Cécile Ducourtieux,Feature
"In Marseille, Chez Freddy's simple, sugar-coated chichis",https://www.lemonde.fr/en/summer-reads/article/2026/07/23/in-marseille-chez-freddy-s-simple-sugar-coated-chichis_6755768_183.html,,Subscribers only,https://img.lemde.fr/2026/07/08/56/120/996/664/198/132/95/0/19b8f64_ftp-1-ep4voor6ngrl-435384-3489000.jpg,,
"Salah Abdeslam, punished for protesting his prison conditions, challenges the administration",https://www.lemonde.fr/en/france/article/2026/07/23/salah-abdeslam-punished-for-protesting-his-prison-conditions-challenges-the-administration_6755762_7.html,,Subscribers only,https://img.lemde.fr/2026/07/22/0/0/8640/5760/198/132/95/0/af4c438_upload-1-rms4b161vrnf-000-46p26cm.jpg,,
Carapaz claims Tour de France 18th stage as Pogacar loses key teammate,https://www.lemonde.fr/en/sports/article/2026/07/23/carapaz-claims-tour-de-france-18th-stage-as-pogacar-loses-key-team-mate_6755773_9.html,,,https://img.lemde.fr/2026/07/23/0/0/6288/4192/198/132/95/0/8f88f3e_ftp-1-rb1yx8ix1c9k-9f82f47e5f5e4398a7753bd6e7400d95-0-149b7cb034b6418db3a0400ede6616a0.jpg,,
NGOs appeal to French state to stop economic support for Israel's occupation of Palestine,https://www.lemonde.fr/en/economy/article/2026/07/23/ngos-appeal-to-french-state-to-stop-economic-support-for-israel-s-occupation-of-palestine_6755759_19.html,,Subscribers only,https://img.lemde.fr/2026/07/22/0/0/5646/3764/198/132/95/0/ea5e374_upload-1-syqvackljyhf-000-33ep6vd.jpg,,
How Macron narrowly averted his environment minister's resignation,https://www.lemonde.fr/en/politics/article/2026/07/23/how-macron-narrowly-averted-his-environment-minister-s-resignation_6755750_5.html,,Subscribers only,,,
Greece to build 'Achilles Shield' defense dome with Israeli arms,https://www.lemonde.fr/en/international/article/2026/07/23/greece-to-build-achilles-shield-defense-dome-with-israeli-arms_6755769_4.html,,,,,
Paris prosecutors open investigation into 'libertine' social network Wyylde,https://www.lemonde.fr/en/pixels/article/2026/07/23/paris-prosecutors-open-investigation-into-libertine-social-network-wyylde_6755761_13.html,,Subscribers only,,,
EU struggles to adopt new round of economic sanctions against Russia,https://www.lemonde.fr/en/international/article/2026/07/23/eu-struggles-to-adopt-new-round-of-economic-sanctions-against-russia_6755756_4.html,,Subscribers only,,,
EU renews online child sex abuse detection powers,https://www.lemonde.fr/en/international/article/2026/07/23/eu-renews-online-child-sex-abuse-detection-powers_6755766_4.html,,,,,
"France evacuates 20,000 as fire rages in southwestern pine forest",https://www.lemonde.fr/en/environment/article/2026/07/23/france-evacuates-20-000-as-fire-rages-in-southwestern-pine-forest_6755764_114.html,,,,,
"Tour de France 2026: The mountains, a dreaded terrain for sprinters struggling to make time",https://www.lemonde.fr/en/sports/article/2026/07/23/tour-de-france-2026-the-mountains-a-dreaded-terrain-for-sprinters-struggling-to-make-time_6755760_9.html,,Subscribers only,,,
"France records nearly 6,000 additional deaths during late June heatwave",https://www.lemonde.fr/en/france/article/2026/07/23/france-records-nearly-6-000-additional-deaths-during-late-june-heatwave_6755753_7.html,,Subscribers only,,,
"How social media bans for young users, now in effect in France, have spread worldwide",https://www.lemonde.fr/en/pixels/article/2026/07/22/how-social-media-bans-for-young-users-now-in-effect-in-france-have-spread-worldwide_6755718_13.html,France has decided to ban those under 15 from major platforms such as Instagram and TikTok. The country is following a global trend that has gained momentum in recent years.,Subscribers only,https://img.lemde.fr/2026/07/21/0/0/3000/2000/664/442/75/0/787e78b_upload-1-tiqvpb9bqo0v-illustration-sans-titre-35-1.jpg,Florian Reynaud,In Depth
"Zelensky forced to dismiss Oleksandr Syrsky, Ukraine's armed forces chief",https://www.lemonde.fr/en/international/article/2026/07/22/zelensky-forced-to-dismiss-oleksandr-syrsky-ukraine-s-armed-forces-chief_6755725_4.html,"Yielding to mounting pressure from demonstrators calling for General Syrsky's departure, Ukrainian President Volodymyr Zelensky reversed course and has replaced him with General Mykhailo Drapaty.",Subscribers only,https://img.lemde.fr/2026/07/21/0/0/1999/1333/664/442/75/0/992f22b_ftp-1-43eto4yofuve-56532e4f9daf4544bb7cca264295bb91-0-8a490e59c26d4d50b2a61f67df231dd6.jpg,Ariane Chemin,In Depth
My life as a Russian exile in Paris: 'You can't fight French bureaucracy',https://www.lemonde.fr/en/summer-reads/article/2026/07/23/my-life-as-a-russian-exile-in-paris-you-can-t-fight-french-bureaucracy_6755746_183.html,"'A Russian in Paris' (1/6). Journalist Elizaveta Osetinskaya, who came to France in 2022 because of her opposition to the war in Ukraine, describes the difficulties she has faced with the prefecture while barely speaking the language.",Subscribers only,https://img.lemde.fr/2026/07/22/296/0/1850/1233/664/442/75/0/eb751a9_upload-1-ct68mxdtxy5i-russieok.jpg,Elizaveta Osetinskaya,Series
France's agriculture law puts government in a bind,https://www.lemonde.fr/en/opinion/article/2026/07/22/france-s-agriculture-law-puts-government-in-a-bind_6755726_23.html,,,,Le Monde,Editorial
'Stopping AI because it carries risks? That would be like banning cars because they cause accidents',https://www.lemonde.fr/en/opinion/article/2026/07/22/stopping-ai-because-it-carries-risks-that-would-be-like-banning-cars-because-they-cause-accidents_6755705_23.html,,Subscribe,,Eric Hazan  and  Olivier Sibony,Op-Ed
China's AI doctrine is a challenge for Europe,https://www.lemonde.fr/en/opinion/article/2026/07/21/china-s-ai-doctrine-is-a-challenge-for-europe_6755686_23.html,,,,Le Monde,Editorial
