title,href,subhead,premium,image,byline,type
French environment minister backtracks on resignation over 'urgency' to act on climate,https://www.lemonde.fr/en/france/article/2026/07/22/french-environment-minister-backtracks-on-resignation-over-urgency-to-act-on-climate_6755719_7.html,"Monique Barbut submitted her resignation to President Emmanuel Macron on Wednesday, but he did not accept it and 'assured her of his support,' her office said.",Subscribers only,https://img.lemde.fr/2026/07/22/0/0/6000/4000/400/266/75/0/8b714ae_ftp-1-brlgy91hjbgt-2026-07-22t100143z-678161766-rc2yimatpack-rtrmadp-3-france-politics.JPG,,
"How social media bans for young users, now in effect in France, have spread worldwide",https://www.lemonde.fr/en/pixels/article/2026/07/22/how-social-media-bans-for-young-users-now-in-effect-in-france-have-spread-worldwide_6755718_13.html,,Subscribers only,https://img.lemde.fr/2026/07/21/0/0/3000/2000/398/265/75/0/787e78b_upload-1-tiqvpb9bqo0v-illustration-sans-titre-35-1.jpg,,
Orléans museum launches 'Wanted' campaign to track down 424 looted artworks,https://www.lemonde.fr/en/culture/article/2026/07/22/orleans-museum-launches-wanted-campaign-to-track-down-424-looted-artworks_6755711_30.html,,Subscribers only,https://img.lemde.fr/2026/07/21/276/0/1000/666/398/265/75/0/8ffb998_upload-1-hdvfmp8aqmzx-campagne-wanted-3.jpg,,
Cédric Jubillar admitted to killing his wife after five years of denial. Here is what he told the authorities,https://www.lemonde.fr/en/france/article/2026/07/22/cedric-jubillar-admitted-to-killing-his-wife-after-five-years-of-denial-here-is-what-he-told-the-authorities_6755716_7.html,"'It took me a few moments to realize I had just killed the mother of my children,' Cédric Jubillar said on July 15, according to an official court record Le Monde has read.",Subscribers only,https://img.lemde.fr/2026/07/21/0/0/5781/3854/398/265/75/0/4052a55_ftp-1-0uqqz5gxg22p-5674548-01-06.jpg,,
"Google's AI Overview, now available in France, raises anticipation and concern",https://www.lemonde.fr/en/pixels/article/2026/07/22/google-s-ai-overview-now-available-in-france-raises-anticipation-and-concern_6755715_13.html,"Publishers fear they could lose a significant portion of their web traffic with these tools, which are already available in other countries.",Subscribers only,https://img.lemde.fr/2026/07/21/0/7/4498/2999/398/265/75/0/3a9d4e5_upload-1-wjvnnxkrrx8m-ai-overviews-adria-fruitos.jpg,,
"Louvre heist gallery reopens to public, but with nothing to steal",https://www.lemonde.fr/en/culture/article/2026/07/22/louvre-heist-gallery-to-reopen-to-public-on-wednesday_6755714_30.html,"The Louvre Museum's Apollo Gallery reopened for the first time since thieves broke into it and stole jewels in October 2025. It has been emptied of the remaining jewels, which are set to be displayed in a secure space in the museum.",,https://img.lemde.fr/2026/07/22/0/0/7935/5290/398/265/75/0/4dd3ee8_ftp-1-4qmgax4z2x9j-2026-07-22t082057z-2006835771-rc2vimawdxna-rtrmadp-3-france-crime-louvre.JPG,,
"Bernard Arnault's business-first strategy with foreign heads of state, from Trump to Putin",https://www.lemonde.fr/en/summer-reads/article/2026/07/22/bernard-arnault-s-business-first-strategy-with-foreign-heads-of-state-from-trump-to-putin_6755709_183.html,"'Bernard Arnault's Empire' (3/6). The head of LVMH, which generates 70% of its revenue outside Europe, has fostered relationships with the leaders of the markets he targets. Foremost among them is the president of the United States, whom he has courted since the 1980s.",Subscribers only,https://img.lemde.fr/2026/07/16/2/0/2464/1642/664/442/75/0/038044e_upload-1-5wgurtsrpvou-gettyimages-124071972.jpg,Raphaëlle Bacqué and  Vanessa Schneider,Investigation
French MPs pass law banning social media for under-15s,https://www.lemonde.fr/en/pixels/article/2026/07/21/french-mps-pass-law-banning-social-media-for-under-15s_6755701_13.html,,Subscribers only,https://img.lemde.fr/2025/09/02/0/102/1296/864/198/132/95/0/60fd66c_ftp-import-images-1-bey67fqg8yv4-395184-3436298.jpg,,
Kremlin propagandist Xenia Fedorova escapes EU sanctions targeting Russian figures,https://www.lemonde.fr/en/international/article/2026/07/22/kremlin-propagandist-xenia-fedorova-escapes-eu-sanctions-targeting-russian-figures_6755722_4.html,,Subscribers only,https://img.lemde.fr/2026/07/22/0/0/4255/2837/198/132/95/0/d71efd1_upload-1-eu4vty5ip4wu-080-hl-mrenaud-3184169.jpg,,
French model scout and alleged recruiter for Epstein found dead,https://www.lemonde.fr/en/france/article/2026/07/22/epstein-case-french-model-scout-and-alleged-recruiter-found-dead_6755717_7.html,,,https://img.lemde.fr/2026/07/22/0/0/1788/1192/198/132/95/0/44919c0_upload-1-hinmdz8rc80r-capture-d-e-cran-2026-07-22-a-11-12-11-am.png,,
Wildfire in southern France contained,https://www.lemonde.fr/en/environment/article/2026/07/21/hundreds-evacuated-as-wildfire-spreads-in-southern-france_6755702_114.html,,,https://img.lemde.fr/2026/07/21/0/0/5836/3890/198/132/95/0/f4890c4_ftp-1-gzmgzdvzhy0a-2026-07-21t144645z-219990632-rc2eima2p5gn-rtrmadp-3-europe-weather-france-wildfire.JPG,,
Why 19 men have been charged in a French mass rapes case,https://www.lemonde.fr/en/videos/video/2026/07/21/watch-why-19-men-have-been-charged-in-a-french-mass-rapes-case_6755692_108.html,,,,,
"Despite living 'like a walking dead man,' South Africa's Thabiso Zulu continues crusade against ANC corruption",https://www.lemonde.fr/en/le-monde-africa/article/2026/07/22/south-africa-despite-living-like-a-walking-dead-man-thabiso-zulu-continues-crusade-against-anc-corruption_6755723_124.html,,Subscribers only,,,
Zelensky sacks army chief Syrsky after days of protests,https://www.lemonde.fr/en/international/article/2026/07/21/zelensky-sacks-army-chief-syrsky-after-days-of-protests_6755704_4.html,,,,,
The Chinese AI threatening Silicon Valley,https://www.lemonde.fr/en/pixels/article/2026/07/21/the-chinese-ais-threatening-silicon-valley_6755699_13.html,,Subscribers only,,,
'The country is underrated': Tourists flock to Ethiopia despite ongoing security concerns,https://www.lemonde.fr/en/le-monde-africa/article/2026/07/22/the-country-is-underrated-tourists-flock-to-ethiopia-despite-ongoing-security-concerns_6755707_124.html,,Subscribers only,,,
"New monkey species identified in Lomami National Park, Democratic Republic of Congo",https://www.lemonde.fr/en/environment/article/2026/07/22/new-monkey-species-identified-in-lomami-national-park-democratic-republic-of-congo_6755710_114.html,,Subscribers only,,,
"Sleeping Beauty syndrome: 'For a week, I slept 15 to 20 hours out of every 24'",https://www.lemonde.fr/en/summer-reads/article/2026/07/22/sleeping-beauty-syndrome-for-a-week-i-slept-15-to-20-hours-out-of-every-24_6755706_183.html,,Subscribers only,,,
France's must-see art exhibitions this summer,https://www.lemonde.fr/en/culture/article/2026/07/19/france-s-must-see-art-exhibitions-this-summer_6755615_30.html,,Subscribers only,,,
"Bernard Arnault, a 'free-marketeer' who whispers in the ear of every president",https://www.lemonde.fr/en/summer-reads/article/2026/07/21/bernard-arnault-a-free-marketeer-who-whispers-in-the-ear-of-every-president_6755675_183.html,"'Bernard Arnault's Empire' (2/6). LVMH's boss has never hidden his allegiance to France's pro-business, establishment right. He's close to fellow billionaire Vincent Bolloré and, above all, pragmatic. Now he's preparing for the far right's rise to power.",Subscribers only,https://img.lemde.fr/2026/07/16/0/0/2665/1777/664/442/75/0/a4d6de5_upload-1-isqqe01u1htp-000-9na3td.jpg,Raphaëlle Bacqué and  Vanessa Schneider,Investigation
Climate scientists aren't surprised by summer's record heat: 'We've entered a dangerous zone',https://www.lemonde.fr/en/environment/article/2026/07/21/climate-scientists-aren-t-surprised-by-summer-s-record-heat-we-ve-entered-a-dangerous-zone_6755684_114.html,"Record heat, historic drought and sweeping wildfires have marked France's 2026 summer. Yet climate scientists mostly see global warming's expected effects playing out. Only the rapid succession of heatwaves has caught them off guard.",Subscribers only,https://img.lemde.fr/2026/06/25/168/0/4000/2666/664/442/75/0/8be6d71_upload-1-w8mo3vjsz1f3-raf-paris-canicule-nocturne-037.JPG,Audrey Garric,Round-up
"Inside the court of France's richest man, Bernard Arnault",https://www.lemonde.fr/en/summer-reads/article/2026/07/19/bernard-arnault-inside-the-court-of-france-s-richest-man_6755617_183.html,'Bernard Arnault's Empire' (1/6). The billionaire at the head of LVMH is as secretive as he is powerful. He relies on a devoted entourage in which a mix of fear and admiration prevails.,Subscribers only,https://img.lemde.fr/2026/07/16/1736/0/4000/2666/664/442/75/0/3630522_upload-1-tarby5yocvaj-l1070311.jpg,Raphaëlle Bacqué and  Vanessa Schneider,Investigation
China's AI doctrine is a challenge for Europe,https://www.lemonde.fr/en/opinion/article/2026/07/21/china-s-ai-doctrine-is-a-challenge-for-europe_6755686_23.html,,,,Le Monde,Editorial
'Stopping AI because it carries risks? That would be like banning cars because they cause accidents',https://www.lemonde.fr/en/opinion/article/2026/07/22/stopping-ai-because-it-carries-risks-that-would-be-like-banning-cars-because-they-cause-accidents_6755705_23.html,,Subscribe,,Eric Hazan  and  Olivier Sibony,Op-Ed
"'We are trapped in a climate dystopia, a black comedy scenario, where the grotesque rivals the Orwellian farce'",https://www.lemonde.fr/en/opinion/article/2026/07/18/we-are-trapped-in-a-climate-dystopia-a-black-comedy-scenario-where-the-grotesque-rivals-the-orwellian-farce_6755609_23.html,,Subscribe,,Stéphane Foucart,Column
