title,href,subhead,premium,image,byline,type
19 men charged in mass rapes case among 'libertines' in France,https://www.lemonde.fr/en/france/article/2026/07/17/19-men-charged-in-mass-rapes-case-among-libertines-in-france_6755571_7.html,"A man identified as Christophe B. is accused of having forced six former partners into extremely violent sexual encounters with dozens of men recruited online over a period of more than 20 years, under the guise of 'libertinism.'",Subscribers only,https://img.lemde.fr/2026/07/14/1807/0/4252/2834/400/266/75/0/0aa5ac5_upload-1-kt230soit05h-bordeaux-viol-1-def.jpg,,
"Andy Burnham declared leader of Britain's Labour Party, set to be PM on Monday",https://www.lemonde.fr/en/international/article/2026/07/17/andy-burnham-declared-leader-of-britain-s-labour-party-set-to-be-pm-on-monday_6755573_4.html,,,https://img.lemde.fr/2026/07/17/0/0/4861/3240/398/265/75/0/3679f0a_ftp-1-wuqxsgqiizy4-bf785d1d2316473ba28718bba78ffdb9-0-160a8a40fff74c728094120820d4143a.jpg,,
"Germany to join French military nuclear exercise, Merz says",https://www.lemonde.fr/en/international/article/2026/07/17/germany-to-join-french-military-nuclear-exercise-merz-says_6755579_4.html,,,https://img.lemde.fr/2026/07/17/0/0/2691/1794/398/265/75/0/a688fe2_ftp-1-yhkngwn4zb2u-2026-07-17t121118z-496192331-rc2lfmav03v1-rtrmadp-3-germany-france-politics.JPG,,
French regulators order block of Polymarket's website,https://www.lemonde.fr/en/france/article/2026/07/17/france-blocks-access-to-polymarket_6755581_7.html,The French gambling regulator said the site's continued availability constituted advertising. A ban on financial transactions to the site was already in place.,,https://img.lemde.fr/2026/07/07/0/0/7810/5207/398/265/75/0/ca2756f_ftp-1-foxybbtt5pxn-93ec120108e64ab1bb57b9e36e07912c-0-a7ef071c30ab45469a80cc2aa4a01bc0.jpg,,
Trump delivers conspiracy-tinged speech on US elections and accuses China of interference,https://www.lemonde.fr/en/international/article/2026/07/17/trump-delivers-conspiracy-tinged-speech-on-us-elections-and-accuses-china-of-interference_6755570_4.html,"In a televised address on Thursday, the US president contested, once again, the 2020 US presidential election results, referencing a so-called 'deep state' that allegedly hid evidence of Chinese meddling.",Subscribers only,https://img.lemde.fr/2026/07/17/0/111/7681/5121/398/265/75/0/30a9244_ftp-1-8gvyovi0vznt-5641336-01-06.jpg,,
"Behind the scenes of Macron's last G7, as told by photographer Kamil Zihnioglu",https://www.lemonde.fr/en/international/article/2026/07/17/behind-the-scenes-of-emmanuel-macron-s-last-g7-as-told-by-photographer-kamil-zihnioglu_6755560_4.html,"There is protocol, and then there is Donald Trump. That, in essence, is what photographer Kamil Zihnioglu took away from his three days covering the G7 summit in Evian-les-Bains for Le Monde.",Subscribers only,https://img.lemde.fr/2026/06/18/0/0/5000/3333/398/265/75/0/5fc8fd6_upload-1-m5nwut8a843f-kzihnioglu-evian-g7-15062026-3-55.JPG,,
The troubling Russian connections of a 'European' password manager,https://www.lemonde.fr/en/pixels/article/2026/07/17/the-troubling-russian-connections-of-a-european-password-manager_6755564_13.html,"Although it presents itself as a Spanish company, Passwork was actually developed in Russia and operates with a license from Russia's FSB domestic intelligence agency. The situation raises major security questions for its customers, including several French companies.",Subscribers only,https://img.lemde.fr/2026/07/09/0/0/3000/2000/664/442/75/0/c10e2e3_upload-1-prwrdqrioib1-illustration-sans-titre-23.jpg,Damien Leloup,Investigation
"Paris region deaths doubled during June heatwave, say health authorities",https://www.lemonde.fr/en/france/article/2026/07/17/paris-region-deaths-doubled-during-june-heatwave-say-health-authorities_6755578_7.html,,,https://img.lemde.fr/2026/06/25/0/0/5899/3932/198/132/95/0/9bc96d5_ftp-1-d9pkagx7p8yg-2026-06-25t163249z-1507762908-rc2y0ma2s92j-rtrmadp-3-europe-weather-france-hospital.JPG,,
Zelensky sparks Ukraine political crisis with cabinet reshuffle,https://www.lemonde.fr/en/international/article/2026/07/17/zelensky-sparks-ukraine-political-crisis-with-cabinet-reshuffle_6755567_4.html,,Subscribers only,https://img.lemde.fr/2026/07/16/354/0/2953/1968/198/132/95/0/ba6a63e_upload-1-52qhmqrnv9is-2026-07-16-heg-ukraine-0159.JPG,,
French Greens push for national debate on climate leave,https://www.lemonde.fr/en/politics/article/2026/07/17/french-greens-push-for-national-debate-on-climate-leave_6755576_5.html,,Subscribers only,https://img.lemde.fr/2026/07/16/0/0/4675/3116/198/132/95/0/79c596f_upload-1-diw61v6tmduk-000-b8kw4t3.jpg,,
Economist Olivier Blanchard: 'France's budget process is flawed and increases the risk of a debt crisis',https://www.lemonde.fr/en/opinion/article/2026/07/17/economist-olivier-blanchard-france-s-budget-process-is-flawed-and-increases-the-risk-of-a-debt-crisis_6755563_23.html,,Subscribers only,https://img.lemde.fr/2026/02/25/0/0/1500/1000/198/132/95/0/48f8e23_upload-1-cupttdbvkahu-frame-842.jpg,,
"'Contemporary films about the Occupation in France are sounding alarm bells, with varying degrees of subtlety'",https://www.lemonde.fr/en/opinion/article/2026/07/17/contemporary-films-about-the-occupation-in-france-sound-alarm-bells-with-varying-degrees-of-subtlety_6755557_23.html,,Subscribers only,,,
European Broadcasting Union shares new guidelines to avoid sexualizing female athletes,https://www.lemonde.fr/en/sports/article/2026/07/17/before-the-european-athletics-championships-broadcasters-receive-recommendations-to-film-female-athletes-with-dignity-and-respect_6755562_9.html,,,,,
France faces water shortages: 'Conservation must become a collective reflex',https://www.lemonde.fr/en/environment/article/2026/07/16/france-faces-water-shortages-after-successive-heatwaves-conservation-must-become-a-collective-reflex_6755535_114.html,,Subscribers only,,,
'People go to the bathroom without their phone?',https://www.lemonde.fr/en/m-le-mag/article/2026/07/17/people-go-to-the-bathroom-without-their-phone_6755575_117.html,,Subscribers only,,,
'Sometimes I wake up in the night and I can't move': What is sleep paralysis?,https://www.lemonde.fr/en/summer-reads/article/2026/07/17/sometimes-i-wake-up-in-the-night-and-i-can-t-move-what-is-sleep-paralysis_6755559_183.html,,Subscribers only,,,
"After Fontainebleau fire, Macron shows support for firefighters and hits back at criticism",https://www.lemonde.fr/en/politics/article/2026/07/17/every-time-a-fire-breaks-out-it-is-our-national-territory-that-is-under-attack-in-fontainebleau-macron-shows-support-for-firefighters-and-responds-to-criticism_6755555_5.html,,Subscribers only,,,
Tour de France: Swiss rider Mauro Schmid wins stage 13,https://www.lemonde.fr/en/sports/article/2026/07/17/tour-de-france-swiss-rider-mauro-schmid-wins-stage-13_6755582_9.html,,,,,
"As her deputy questions promise to ban headscarves, Le Pen doubles down",https://www.lemonde.fr/en/politics/article/2026/07/16/as-her-deputy-questions-promise-to-ban-headscarves-le-pen-doubles-down_6755519_5.html,,Subscribers only,,,
'It's Mad Max on the ocean': The cocaine-loaded speedboats racing to Europe's shores,https://www.lemonde.fr/en/videos/article/2026/07/16/mad-max-on-the-ocean-the-cocaine-loaded-speedboats-racing-to-europe-s-shores_6755521_108.html,"In the Atlantic, hundreds of powerful go-fast boats, custom-built to transport tons of cocaine, retrieve shipments from vessels traveling commercial routes between South America, Africa and Europe, according to an investigation by Le Monde in partnership with NDR, WDR, Süddeutsche Zeitung, NRC, IrpiMedia and The Washington Post.",Subscribers only,https://img.lemde.fr/2026/07/15/0/0/2047/1364/664/442/75/0/8277ab7_upload-1-6ocg2ryaqfdf-frame-2.jpg,"Liselotte Mas,  Elsa Delmas and  Thomas Saintourens",Investigation
"How the 2016 Nice terrorist attack unfolded, minute-by-minute",https://www.lemonde.fr/en/france/video/2026/07/13/how-the-2016-nice-terrorist-attack-unfolded-minute-by-minute_6755441_7.html,"On July 14, 2016, a terrorist drove a truck into crowds gathered on the famed Promenade des Anglais in the southern French city, killing 86 people. Ten years later, Le Monde looks back at how the tragedy unfolded.",Subscribers only,https://img.lemde.fr/2026/07/10/0/150/1620/1080/664/442/75/0/6098888_upload-1-xyixzbdp93j4-6098888-upload-1-hbrfj3utpffd-nice-recit-sirius.png,,Investigation
Visualize the full extent of wildfires across Europe in recent weeks,https://www.lemonde.fr/en/les-decodeurs/article/2026/07/14/visualize-the-full-extent-of-wildfires-across-europe-in-recent-weeks_6755451_8.html,The burned areas across the European continent have already far surpassed levels seen in recent years and are now approaching the maximum recorded in 2025.,Subscribers only,https://img.lemde.fr/2026/07/10/0/0/3840/2560/664/442/75/0/f3c2a33_upload-1-pzmr8dmczv5t-media-d-appel-light.png,Pierre Breteau,In Graphs
Addressing rape culture to better denounce it,https://www.lemonde.fr/en/opinion/article/2026/07/17/addressing-rape-culture-to-better-denounce-it_6755572_23.html,,,,Le Monde,Editorial
"The International Criminal Court, an imperfect but essential safeguard against impunity",https://www.lemonde.fr/en/opinion/article/2026/07/16/the-international-criminal-court-an-imperfect-but-essential-safeguard-against-impunity_6755538_23.html,,,,Le Monde,Editorial
'It would have been enough to learn the terrible lessons from Gaza to anticipate the current impasse over Iran',https://www.lemonde.fr/en/international/article/2026/07/12/it-would-have-been-enough-to-learn-the-terrible-lessons-from-gaza-to-anticipate-the-current-impasse-over-iran_6755416_4.html,,Subscribe,https://img.lemde.fr/2023/07/31/0/0/0/0/100/100/60/0/d45bb07_1690791602941-eac5c14-1647333440018-jean-pierre-filiu-2019.jpg,Jean-Pierre Filiu,Column
