title,href,subhead,premium,image,byline,type
"French 'libertines' rapes case: From livestreams to camp sites, where the sexual crimes took place",https://www.lemonde.fr/en/france/article/2026/07/20/french-libertines-rapes-case-from-livestreams-to-camp-sites-where-the-sexual-crimes-took-place_6755660_7.html,"Christophe B. and many other men he recruited are accused of raping women, with these sexual assaults broadcast online and in public. Responsibility is now being called into question. This is the final part of our investigation into the French 'libertines' rapes case.",Subscribers only,https://img.lemde.fr/2026/07/15/0/0/6378/4252/400/266/75/0/2659e9b_upload-1-nxlurhwkaspg-bordeaux-viols-def.jpg,,
"Between China and the US, a new diplomacy of detainees emerges",https://www.lemonde.fr/en/international/article/2026/07/21/between-china-and-the-us-a-new-diplomacy-of-detainees-emerges_6755667_4.html,,Subscribers only,https://img.lemde.fr/2026/07/17/211/0/1363/908/398/265/75/0/8d47dab_upload-1-1sm6mmni594q-02b13946-d026-4635-ae7e-26ad484b67ad.JPG,,
Andy Burnham enters Downing Street and appoints former defense minister John Healey as chancellor of the Exchequer,https://www.lemonde.fr/en/international/article/2026/07/21/andy-burnham-enters-downing-street-and-appoints-former-defense-minister-john-healey-as-chancellor-of-the-exchequer_6755671_4.html,,Subscribers only,https://img.lemde.fr/2026/07/20/0/0/5941/3960/398/265/75/0/e385e9c_ftp-1-gdxlmynt6phz-5667195-01-06.jpg,,
Trump to impose 50% tariffs on many Canadian goods,https://www.lemonde.fr/en/international/article/2026/07/21/trump-to-impose-50-tariffs-on-many-canadian-goodstrump-to-impose-50-tariffs-on-many-canadian-good_6755670_4.html,"The US president is claiming 'discriminatory treatment' against American alcohol, automobile and dairy products. The tariffs will take effect in 30 days.",,https://img.lemde.fr/2026/07/02/0/241/4518/3012/398/265/75/0/831b913_ftp-1-9ydvmmtkweck-2026-07-02t161903z-1976892611-rc2rbdaq4h02-rtrmadp-3-pembina-pipe-power-canada.JPG,,
"In southern Lebanon, at the Secours populaire hospital in Nabatieh, caregivers strive to overcome the traumas of war",https://www.lemonde.fr/en/international/article/2026/07/21/in-southern-lebanon-at-the-secours-populaire-hospital-in-nabatieh-caregivers-strive-to-overcome-the-traumas-of-war_6755669_4.html,"Doctors Without Borders provides individual counseling and group therapy sessions to professionals who have endured four months of conflict and an ongoing, unstable security situation.",Subscribers only,https://img.lemde.fr/2026/05/31/168/0/4000/2666/398/265/75/0/7c6f5d4_upload-1-q3hktdt7ba52-raf-liban-nabatieh-05-26-010.JPG,,
Climate change: Why the ECB refuses to create a lower interest rate for green investments,https://www.lemonde.fr/en/economy/article/2026/07/21/climate-change-why-the-ecb-refuses-to-create-a-lower-interest-rate-for-green-investments_6755672_19.html,"China's central bank guarantees low-cost funding for green investments. Its European counterpart, although a frontrunner on climate change, currently refuses to use this tool.",Subscribers only,https://img.lemde.fr/2026/07/03/0/0/5500/3666/398/265/75/0/ec1e6b2_ftp-1-u7xfrrbcocep-2026-07-03t072138z-670829081-rc2prla24tvf-rtrmadp-3-ecb-policy-lagarde.JPG,,
"Cleanliness in Paris: Study reveals 1,412 spots left systematically unclean",https://www.lemonde.fr/en/politics/article/2026/07/20/cleanliness-in-paris-study-reveals-1-412-spots-left-systematically-unclean_6755662_5.html,"Paris City Hall turned to architects and municipal cleaning workers to identify 1,412 'black spots,' small public spaces that are systematically soiled or clogged with bulky waste, which it aims to reduce to 1,000.",Subscribers only,https://img.lemde.fr/2026/07/10/1/0/7488/4992/664/442/75/0/a537272_upload-1-dikxytzafpim-000-a94l6eq.jpg,Hélène Bekmezian,In Depth
Repeated heatwaves fuel eco-anxiety and anger among youth: 'It feels like we're living in a dystopia',https://www.lemonde.fr/en/campus/article/2026/07/21/repeated-heatwaves-fuel-eco-anxiety-and-anger-among-youth-it-feels-like-we-re-living-in-a-dystopia_6755674_11.html,,Subscribers only,https://img.lemde.fr/2026/07/14/0/30/3543/2362/198/132/95/0/7591f29_upload-1-uezoeglab8jp-ecoanxietehd.jpg,,
Spain stars celebrate with adoring fans at World Cup parade of around two million in Madrid,https://www.lemonde.fr/en/sports/article/2026/07/21/spain-stars-celebrate-with-adoring-fans-at-world-cup-parade-of-around-two-million-in-madrid_6755673_9.html,,,https://img.lemde.fr/2026/07/20/0/0/6000/4000/198/132/95/0/00db4a7_ftp-1-xfdm7m0i0l8r-d7ea614cab574f569b20bf29f5a0b657-0-83f4b345b45e4cd38abdd529f9cad987.jpg,,
Tate brothers' lawyer says they will fight UK extradition on sex crime charges,https://www.lemonde.fr/en/international/article/2026/07/21/tate-brothers-lawyer-says-they-will-fight-uk-extradition-on-sex-crime-charges_6755668_4.html,,,https://img.lemde.fr/2026/07/20/30/0/6000/4000/198/132/95/0/e59d098_ftp-1-23wukdc2vslv-5669440-01-06.jpg,,
US judge suspends Paramount's acquisition of Warner Bros,https://www.lemonde.fr/en/economy/article/2026/07/20/us-judge-suspends-paramount-s-acquisition-of-warner-bros_6755666_19.html,,,https://img.lemde.fr/2026/07/13/233/0/7507/5004/198/132/95/0/56d8bac_ftp-1-qkpflz97hbxb-5613115-01-06.jpg,,
"Amid 'megadeal' frenzy, global companies brush off geopolitical tensions",https://www.lemonde.fr/en/economy/article/2026/07/20/amid-megadeal-frenzy-global-companies-brush-off-geopolitical-tensions_6755659_19.html,,Subscribers only,,,
UK man charged with murder of right-wing ex-MP Ann Widdecombe,https://www.lemonde.fr/en/international/article/2026/07/20/uk-man-charged-with-murder-of-right-wing-ex-mp-ann-widdecombe_6755664_4.html,,,,,
France denounces 'act of intimidation' against two of its diplomats in Iran,https://www.lemonde.fr/en/international/article/2026/07/20/france-denounces-act-of-intimidation-against-two-of-its-diplomats-in-iran_6755661_4.html,,,,,
Mexican drug lord 'El Mayo' sentenced by US court to life in prison,https://www.lemonde.fr/en/international/article/2026/07/20/mexican-drug-lord-el-mayo-sentenced-by-us-court-to-life-in-prison_6755663_4.html,,,,,
Guinea asks France to return colonization-era looted manuscripts,https://www.lemonde.fr/en/international/article/2026/07/20/guinea-asks-france-to-return-colonization-era-looted-manuscripts_6755654_4.html,,Subscribers only,,,
Far-right Nigel Farage faces an unlikely opponent: Count Binface,https://www.lemonde.fr/en/international/article/2026/07/20/far-right-nigel-farage-faces-an-unlikely-opponent-count-binface_6755649_4.html,,Subscribers only,,,
"Along Paris's Canal Saint-Martin, residents want the noise to stop",https://www.lemonde.fr/en/politics/article/2026/07/20/along-paris-s-canal-saint-martin-residents-want-the-noise-to-stop_6755658_5.html,,Subscribers only,,,
European Commission imposes record €550 million fine on AliExpress,https://www.lemonde.fr/en/economy/article/2026/07/20/european-commission-imposes-record-550-million-fine-on-aliexpress_6755655_19.html,,Subscribers only,,,
France's must-see art exhibitions this summer,https://www.lemonde.fr/en/culture/article/2026/07/19/france-s-must-see-art-exhibitions-this-summer_6755615_30.html,"Le Monde's critics present our selection of exhibitions on painting, contemporary art and photography across France.",Subscribers only,https://img.lemde.fr/2026/06/30/0/0/960/640/664/442/75/0/7c620db_upload-1-tnnb4we2voct-1f9859f2acf9603a859f2acf9b6a85v-960x640.jpg,,Selection
"BTS electrifies Stade de France, seven years after their last Paris concert",https://www.lemonde.fr/en/culture/article/2026/07/19/bts-electrifies-stade-de-france-seven-years-after-their-last-paris-concert_6755618_30.html,The world tour of the industry's most powerful K-pop group wrapped up its European leg in Saint-Denis on July 17 and July 18.,Subscribers only,https://img.lemde.fr/2026/03/20/100/76/2871/1914/664/442/75/0/f701939_ftp-1-5xcd2qgb06f6-ed6c07d21f144f79b90c882517d29dfd-0-f4093857ac124d28943c2804f6f555be.jpg,Laetitia Limmois,Review
Is the Bible terrifying? Three frightening stories from the holy book,https://www.lemonde.fr/en/religions/article/2026/07/19/is-the-bible-terrifying-three-frightening-stories-from-the-holy-book_6755627_63.html,"The biblical corpus shared by Judaism and Christianity contains scenes of extraordinary violence, sometimes embodied by terrifying figures. For centuries, such passages have puzzled scholars and fascinated readers.",Subscribers only,https://img.lemde.fr/2026/07/16/0/23/2010/1340/664/442/75/0/05c1015_upload-1-lzfwccb5kfvk-1991-216-16-the-destruction-of-sodom-and-gomorrah-from.jpg,Gaétan Supertino,In Depth
Donald Trump and his troubling electoral obsessions,https://www.lemonde.fr/en/opinion/article/2026/07/18/donald-trump-and-his-troubling-electoral-obsessions_6755603_23.html,,,,Le Monde,Editorial
"'We are trapped in a climate dystopia, a black comedy scenario, where the grotesque rivals the Orwellian farce'",https://www.lemonde.fr/en/opinion/article/2026/07/18/we-are-trapped-in-a-climate-dystopia-a-black-comedy-scenario-where-the-grotesque-rivals-the-orwellian-farce_6755609_23.html,,Subscribe,,Stéphane Foucart,Column
Addressing rape culture to better denounce it,https://www.lemonde.fr/en/opinion/article/2026/07/17/addressing-rape-culture-to-better-denounce-it_6755572_23.html,,,,Le Monde,Editorial
