title,href,subhead,premium,image,byline,type
"250 years of American independence: Thomas Jefferson and John Adams, 'the North and South poles of the American Revolution'",https://www.lemonde.fr/en/international/article/2026/06/25/250-years-of-american-independence-thomas-jefferson-and-john-adams-the-north-and-south-poles-of-the-american-revolution_6754877_4.html,"'America 250' (4/13). Fifty years to the day after the adoption of the Declaration of Independence, two of its architects died: the enigmatic Thomas Jefferson and the impulsive John Adams. This coincidence only strengthened, among the population, the sense of an unprecedented destiny promised to their nation.",Subscribers only,https://img.lemde.fr/2026/06/19/482/0/1654/1102/400/266/75/0/d8c172d_upload-1-cozet23hg7u6-capture-d-e-cran-2026-06-19-a-11-38-02.jpg,,
Court rules oil and gas giant TotalEnergies must account for its clients' CO₂ emissions,https://www.lemonde.fr/en/environment/article/2026/06/25/court-rules-oil-and-gas-giant-totalenergies-must-account-for-its-clients-co-emissions_6754878_114.html,,Subscribers only,https://img.lemde.fr/2026/06/24/0/0/4293/2862/398/265/75/0/c2e6353_ftp-1-icnbs1kauh71-5430292-01-06.jpg,,
Venezuela reels after deadliest double earthquake in 126 years,https://www.lemonde.fr/en/environment/article/2026/06/25/venezuela-reels-after-deadliest-double-earthquake-in-126-years_6754858_114.html,,Subscribers only,https://img.lemde.fr/2026/06/25/0/0/6192/4128/398/265/75/0/d650c78_ftp-1-p5or2tdwlx9h-5434315-01-06.jpg,,
"Paris Mayor Grégoire on the climate crisis: 'To adapt together, we need to change our way of life'",https://www.lemonde.fr/en/politics/article/2026/06/25/paris-mayor-gregoire-on-the-climate-crisis-to-adapt-together-we-need-to-change-our-way-of-life_6754853_5.html,"In an interview with Le Monde, the Socialist leader of the French capital city called individual air conditioning 'a scourge' and urged 'flexibility' and 'makeshift solutions' to respond to the urgent challenge of heat waves.",Subscribers only,https://img.lemde.fr/2026/05/27/667/0/5000/3333/398/265/75/0/04b2959_upload-1-ppa7uoxr3rd3-kzihnioglu-paris-pol-canicule-gregoire-emmanuel-27052026-34.jpg,,
"'Impossible to sleep': A night in sweltering France, in search of a cool spot",https://www.lemonde.fr/en/politics/article/2026/06/25/impossible-to-sleep-a-night-in-sweltering-france-in-search-of-a-cool-spot_6754874_5.html,"With a heatwave bearing down, the French have taken to living after dark, chasing relief from the sun's lingering grip. From Paris to Saint-Malo, by way of Orléans, parks and pools stirred to life as soon as the day ended.",Subscribers only,https://img.lemde.fr/2026/06/25/168/0/4000/2666/398/265/75/0/56b4880_upload-1-p6wswoz0d6l0-raf-paris-canicule-nocturne-022.JPG,,
Death of Lyhanna: 'Comprehensive law' on Assemblée Nationale's agenda marks victory for feminist and child advocacy groups,https://www.lemonde.fr/en/politics/article/2026/06/25/death-of-lyhanna-comprehensive-law-on-assemblee-nationale-s-agenda-marks-victory-for-feminist-and-child-advocacy-groups_6754868_5.html,"The bill, which aims to strengthen the fight against gender-based and sexual violence, will be debated in the fall, Prime Minister Sébastien Lecornu announced after a policy reversal. But a review by the Council of State is expected to reshape the law's scope.",Subscribers only,https://img.lemde.fr/2026/06/23/0/0/7999/5333/398/265/75/0/14ab9a2_upload-1-dn7tmhcbxjbd-hanslucas-hl-jmug260623010.jpg,,
"French tolerance remains strong, but racism and antisemitism still run deep, report finds",https://www.lemonde.fr/en/france/article/2026/06/25/french-tolerance-remains-strong-but-racism-and-antisemitism-still-run-deep-report-finds_6754879_7.html,"In its annual report released on Thursday, the National Consultative Commission on Human Rights expresses concern about the persistence of xenophobic prejudices in French society, particularly among the younger generation.",Subscribers only,https://img.lemde.fr/2025/04/29/0/0/8256/5504/664/442/75/0/923943f_sirius-fs-upload-1-ovnwj9ob9xif-1745885482499-000-424y9dl.jpg,Louise Couvelaire,In Depth
Paris bans public drinking as heatwave overwhelms hospitals,https://www.lemonde.fr/en/france/article/2026/06/25/paris-bans-public-drinking-as-heatwave-overwhelms-hospitals_6754880_7.html,,,https://img.lemde.fr/2026/06/23/0/0/7761/5174/198/132/95/0/e17994d_ftp-1-vx6skje0gpqm-5417062-01-06.jpg,,
Three-year-old found dead in car in Paris region during France heatwave,https://www.lemonde.fr/en/france/article/2026/06/25/three-year-old-found-dead-in-car-in-paris-region-during-france-heatwave_6754860_7.html,,,https://img.lemde.fr/2026/06/24/1/0/7490/4993/198/132/95/0/b4b830e_ftp-1-etuvaak2gt3a-5427074-01-06.jpg,,
US judge blocks Trump's bid to reshape voter rules,https://www.lemonde.fr/en/international/article/2026/06/25/us-judge-blocks-trump-s-bid-to-reshape-voter-rules_6754876_4.html,,,https://img.lemde.fr/2026/06/25/0/0/5844/3896/198/132/95/0/53b9cc3_ftp-1-fjucqwlnphrl-2026-06-25t145228z-863870016-rc221makntzj-rtrmadp-3-usa-court.JPG,,
Heatwave drives surge in movie theater attendance,https://www.lemonde.fr/en/economy/article/2026/06/25/heatwave-drives-surge-in-movie-theater-attendance_6754875_19.html,,Subscribers only,https://img.lemde.fr/2026/06/25/0/0/4624/3082/198/132/95/0/0df49df_upload-1-vuszdehdku1f-maxnewsspecialtwo644454.jpg,,
France intercepts suspected Russia-linked oil tanker off the coast of Sicily,https://www.lemonde.fr/en/international/article/2026/06/25/france-intercepts-suspected-russia-linked-oil-tanker-off-the-coast-of-sicily_6754864_4.html,,,,,
Water shortages and heat waves: France on track toward severe summer drought,https://www.lemonde.fr/en/environment/article/2026/06/25/water-shortages-and-heat-waves-france-on-track-toward-severe-summer-drought_6754873_114.html,,Subscribers only,,,
France's public debt soars above €3.5 trillion,https://www.lemonde.fr/en/politics/article/2026/06/25/france-s-public-debt-soars-above-3-5-trillion_6754865_5.html,,Subscribers only,,,
EU-US trade deal to take effect before Trump's deadline,https://www.lemonde.fr/en/economy/article/2026/06/25/eu-us-trade-deal-to-take-effect-before-trump-s-deadline_6754857_19.html,,,,,
Trump uses the United States's 250th anniversary celebrations to celebrate himself,https://www.lemonde.fr/en/international/article/2026/06/25/trump-uses-the-united-states-s-250th-anniversary-celebrations-to-celebrate-himself_6754856_4.html,,Subscribers only,,,
Ukrainian strikes on Russian refineries are triggering shortages and rising discontent,https://www.lemonde.fr/en/international/article/2026/06/25/ukrainian-strikes-on-russian-refineries-are-triggering-shortages-and-rising-discontent_6754849_4.html,,Subscribers only,,,
"EU says Amazon, Microsoft cloud services should face stricter rules",https://www.lemonde.fr/en/pixels/article/2026/06/25/eu-says-amazon-microsoft-cloud-services-should-face-stricter-rules_6754866_13.html,,,,,
New York Mayor Mamdani cements his hold on power after three of his candidates win Democratic primaries,https://www.lemonde.fr/en/international/article/2026/06/24/new-york-mayor-mamdani-cements-his-hold-on-power-after-three-of-his-candidates-win-democratic-primaries_6754841_4.html,,Subscribers only,,,
"Serving a husband, God and America: Young female conservatives gather at San Antonio's Turning Point summit",https://www.lemonde.fr/en/m-le-mag/article/2026/06/23/serving-a-husband-god-and-america-young-female-conservatives-gather-at-san-antonio-s-turning-point-summit_6754806_117.html,"In early June, around 3,000 women attended the Women's Leadership Summit in San Antonio, Texas. This annual event brings together a variety of conservative figures and influencers, relying on the extensive network of Turning Point USA, founded by right-wing activist Charlie Kirk, who was murdered in 2025. After convincing a majority of young men to vote for Trump in 2024, the organization now targets female voters from Gen Z.",Subscribers only,https://img.lemde.fr/2026/06/15/0/4/1492/995/664/442/75/0/d0d1357_ftp-1-tkngv55k1n2q-432511-3476302.jpg,Eve Minault,Feature
Montréal gunman leaves behind manifesto inspired by the 'incel' movement,https://www.lemonde.fr/en/international/article/2026/06/23/montreal-gunman-leaves-behind-manifesto-inspired-by-the-incel-movement_6754781_4.html,"A shooting in the Canadian city on Monday, June 22, left three dead, including a police officer and the attacker. In a manifesto, the shooter expressed his hatred of women.",Subscribers only,https://img.lemde.fr/2026/06/22/0/0/8256/5504/664/442/75/0/2074255_ftp-1-wre1cdsz1c1r-5408805-01-06.jpg,Eliott Dumoulin,News
"Masculinism, an increasingly widespread, violent and popular ideology among French youth",https://www.lemonde.fr/en/france/article/2026/06/25/masculinism-an-increasingly-widespread-violent-and-popular-ideology-among-french-youth_6754852_7.html,"According to a report written by the Sénat's delegation for women's rights and published on Wednesday, the movement, which has close ties to the far right, is now considered an emerging terrorist threat and a cause for serious concern.",Subscribers only,https://img.lemde.fr/2026/06/24/132/0/3667/2444/664/442/75/0/2d9e3cc_upload-1-5slemxuad73p-020-2282976491.jpg,Christophe Ayad and  Solène Cordier,News
Trumpism gains ground in Latin America,https://www.lemonde.fr/en/opinion/article/2026/06/25/trumpism-gains-ground-in-latin-america_6754859_23.html,,,,Le Monde,Editorial
Flagrant unpreparedness to heatwaves highlights urgent need for climate anticipation in France,https://www.lemonde.fr/en/opinion/article/2026/06/22/flagrant-unpreparedness-to-heatwaves-highlights-urgent-need-for-climate-anticipation-in-france_6754743_23.html,,,,Le Monde,Editorial
'The special tribunal on the aggression against Ukraine could be a major step toward protecting the legal architecture built after World War II',https://www.lemonde.fr/en/international/article/2026/06/25/the-special-tribunal-on-ukraine-s-aggression-could-be-a-major-step-toward-protecting-the-legal-architecture-built-after-world-war-ii_6754844_4.html,,Subscribe,,Stéphanie Maupas,Interview
