title,href,subhead,premium,image,byline,type
How investigators track the causes of wildfires: 'A snail shell and a stone are valuable clues',https://www.lemonde.fr/en/environment/article/2026/07/13/how-investigators-track-the-cause-of-wildfires-a-snail-shell-and-a-stone-are-valuable-clues_6755430_114.html,"Firefighters, police and forest agents are searching for the ignition point of the major fire in southwestern France, much as they would at a crime scene.",Subscribers only,https://img.lemde.fr/2026/07/12/85/0/2048/1365/400/266/75/0/805afc7_upload-1-dikameirbwmx-whatsapp-image-2026-07-09-at-16-58-33.jpeg,,
Major fire rages in Fontainebleau forest near Paris,https://www.lemonde.fr/en/environment/article/2026/07/13/major-fire-rages-in-fontainebleau-forest-near-paris_6755419_114.html,,,https://img.lemde.fr/2026/07/13/0/0/5939/3959/398/265/75/0/da08384_ftp-1-7y5szf7fly2t-5609866-01-06.jpg,,
"Macron and the military: 10 years made of mistrust, hope, and budget hikes",https://www.lemonde.fr/en/politics/article/2026/07/13/macron-and-the-military-10-years-made-of-mistrust-hope-and-budget-hikes_6755429_5.html,,Subscribers only,https://img.lemde.fr/2026/07/12/0/0/6048/4032/398/265/75/0/41eb1da_upload-1-ugm1luniiij7-000-92td8nv-1.jpg,,
France sanctions Russian elite cyberespionage unit 'Turla',https://www.lemonde.fr/en/pixels/article/2026/07/13/france-sanctions-russian-elite-cyberespionage-unit-turla_6755432_13.html,France accused Russia's Federal Security Service (FSB) of a series of cyberattacks targeting French ministries and a research institute working on sensitive subjects. The Russian ambassador to France will be summoned in the coming days.,Subscribers only,https://img.lemde.fr/2026/07/13/0/0/5692/3794/398/265/75/0/f6672a1_ftp-1-lrlcjf78hmfy-2026-07-13t082209z-700640867-rc2m3lavnoca-rtrmadp-3-ukraine-crisis-russia-france.JPG,,
'It would have been enough to learn the terrible lessons from Gaza to anticipate the current impasse over Iran',https://www.lemonde.fr/en/international/article/2026/07/12/it-would-have-been-enough-to-learn-the-terrible-lessons-from-gaza-to-anticipate-the-current-impasse-over-iran_6755416_4.html,The deals that US President Donald Trump so readily boasts about seemed destined to get bogged down in the Middle East right from the start.,Subscribers only,https://img.lemde.fr/2026/06/17/333/0/5000/3333/398/265/75/0/3092298_upload-1-ugwdpc5o1fmq-kzihnioglu-evian-g7-16062026-22.jpg,,
"'I would do a line before service, hidden in the bathroom': How cocaine is flooding the restaurant industry",https://www.lemonde.fr/en/campus/article/2026/07/12/i-would-do-a-line-before-service-hidden-in-the-bathroom-how-cocaine-is-flooding-the-restaurant-industry_6755405_11.html,"Cocaine at work (2/3). From fast-food joints to Michelin-starred restaurants, drug use has become as commonplace as it is alarming in an industry driven by the pursuit of performance, a toxic party culture and grueling working conditions.",Subscribers only,https://img.lemde.fr/2026/06/29/64/68/2123/1415/398/265/75/0/fa5a5a0_upload-1-3mb3abetffat-02-hd-1.jpg,,
"'Thank you, dear Hungary, for proving that anything is always possible'",https://www.lemonde.fr/en/international/article/2026/07/13/thank-you-dear-hungary-for-proving-that-anything-is-always-possible_6755431_4.html,"Jean-Baptiste Chastand, Le Monde's Central Europe correspondent, writes a letter to this 'hostile and surprising' country he has covered for more than 10 years.",Subscribers only,https://img.lemde.fr/2026/04/12/0/0/4000/2666/664/442/75/0/ca3f557_ftp-1-bdzqby4rsttp-7ff5295e6b4342188037076ad01d97db-0-24a67f843e9d40f58fd1322214819d6e.jpg,Jean-Baptiste Chastand,Letter from...
Macron says Europe will defend itself at all costs ahead of Ukraine allies summit,https://www.lemonde.fr/en/international/article/2026/07/13/macron-says-europe-will-defend-itself-at-all-costs-ahead-of-ukraine-allies-summit_6755434_4.html,,,https://img.lemde.fr/2026/07/13/1/0/8192/5461/198/132/95/0/caac92b_ftp-1-sgsdelh7fopf-5610096-01-06.jpg,,
Prominent Moroccan journalist and critic jailed upon arrival in Tangiers,https://www.lemonde.fr/en/international/article/2026/07/13/prominent-moroccan-journalist-and-critic-jailed-upon-arrival-in-tangiers_6755442_4.html,,,https://img.lemde.fr/2026/07/13/0/0/3808/2539/198/132/95/0/9f4b143_ftp-1-uvdzmqojpgw4-5610424-01-06.jpg,,
"Emmanuel Grégoire, an omnipresent Paris mayor with a centralized governance",https://www.lemonde.fr/en/politics/article/2026/07/13/emmanuel-gregoire-an-omnipresent-paris-mayor-with-a-centralized-governance_6755421_5.html,,Subscribers only,https://img.lemde.fr/2026/07/06/188/0/5544/3696/198/132/95/0/5bd1405_upload-1-jpt6bbe6txyb-000-a7b94t3.jpg,,
US and Iran continue strikes as Gulf states targeted in flare-up over Hormuz,https://www.lemonde.fr/en/international/article/2026/07/12/iran-announces-closure-of-the-strait-of-hormuz-until-further-notice_6755387_4.html,,,https://img.lemde.fr/2026/07/12/0/408/4683/3122/198/132/95/0/ef8bff2_ftp-1-q9yq7fq5rn61-2026-07-12t085340z-645449173-rc25cmazvd5u-rtrmadp-3-iran-crisis-oman-hormuz.JPG,,
"French heatwave drives up water consumption, puts supply networks under severe strain",https://www.lemonde.fr/en/environment/article/2026/07/13/french-heatwave-drives-up-water-consumption-puts-supply-networks-under-severe-strain_6755418_114.html,,Subscribers only,,,
Alfred Dreyfus statue finally finds place in heart of Paris,https://www.lemonde.fr/en/politics/article/2026/07/12/alfred-dreyfus-statue-finally-finds-place-in-heart-of-paris_6755409_5.html,,Subscribers only,,,
"EU eyes phased social media access for children, stops short of outright ban",https://www.lemonde.fr/en/pixels/article/2026/07/13/eu-eyes-phased-social-media-access-for-children-stops-short-of-outright-ban_6755436_13.html,,,,,
Why heatwaves disrupt our sleep – and how we can protect it,https://www.lemonde.fr/en/science/article/2026/07/11/why-heatwaves-disrupt-our-sleep-and-how-we-can-protect-it_6755384_10.html,,Subscribers only,,,
French women's baseballers 'not going to give up' after national team is shut down,https://www.lemonde.fr/en/france/article/2026/07/12/french-women-s-baseballers-not-going-to-give-up-after-national-team-is-shut-down_6755410_7.html,,Subscribers only,,,
"Hamad bin Khalifa Al Thani, architect of modern Qatar, dies",https://www.lemonde.fr/en/obituaries/article/2026/07/13/hamad-bin-khalifa-al-thani-architect-of-modern-qatar-dies_6755433_15.html,,Subscribers only,,,
South Korea's Yoon sentenced to two years over illegal opinion polls scheme,https://www.lemonde.fr/en/international/article/2026/07/13/south-korea-s-yoon-sentenced-to-two-years-over-illegal-opinion-polls-scheme_6755428_4.html,,,,,
Record-breaking heat wave hits western US,https://www.lemonde.fr/en/international/article/2026/07/13/record-breaking-heat-wave-hits-western-us_6755423_4.html,,,,,
'We were meant to take as many jewels as we could': The confessions of two Louvre burglars,https://www.lemonde.fr/en/france/article/2026/07/12/we-were-meant-to-take-as-many-jewels-as-we-could-the-confessions-of-two-louvre-burglars_6755398_7.html,"After months of silence, two men suspected of stealing the royal jewels described their involvement in detail during new interrogations in June. According to their statements, they were hired to carry out the heist for '€15,000 to €25,000.'",Subscribers only,https://img.lemde.fr/2026/07/11/0/93/7722/5148/664/442/75/0/2a52031_upload-1-h1iiu0yszurt-000-79ar7mw.jpg,Jérémie Pham-Lê and  Lucie Soullier,In Depth
"Martine Barrat, a photographer without fear or limits",https://www.lemonde.fr/en/m-le-mag/article/2026/07/12/martine-barrat-a-photographer-without-fear-or-limits_6755391_117.html,"At 93, the artist has lost none of her vitality or curiosity. She lives at the legendary Hotel Chelsea in New York, where she remains one of the last year-round artist residents. Today, her work is the subject of a retrospective at the Rencontres d'Arles photography festival.",Subscribers only,https://img.lemde.fr/2026/06/30/382/0/1200/800/664/442/75/0/509e5ca_ftp-1-hbcbynanjmsm-434309-3480713.jpg,Emmanuelle Lequeux,Conversation
Silicon Valley's next generation feels the AI blues,https://www.lemonde.fr/en/m-le-mag/article/2026/07/11/when-it-comes-to-ai-nothing-s-right-silicon-valley-is-torn_6755365_117.html,"In California, the rise of artificial intelligence no longer generates the unanimous enthusiasm it once did. Anxiety is mounting, especially among students and engineers, as jobs have been cut and democratic risks have grown more threatening.",Subscribers only,https://img.lemde.fr/2026/06/23/0/19/1431/954/664/442/75/0/02c5195_ftp-1-isxrj01bdeym-433389-3475879.jpg,Arnaud Leparmentier,Long Read
French MPs' vote to establish presumption of legitimate defense for police sets dangerous precedent,https://www.lemonde.fr/en/opinion/article/2026/07/12/french-mps-vote-to-establish-presumption-of-legitimate-defense-for-police-sets-dangerous-precedent_6755413_23.html,,,,Le Monde,Editorial
"'Diverse France, that of Kylian Mbappé and the national team, is too promising a reality to be used as an electoral punching bag'",https://www.lemonde.fr/en/opinion/article/2026/07/05/diverse-france-that-of-kylian-mbappe-and-the-national-team-is-too-promising-a-reality-to-be-used-as-an-electoral-punching-bag_6755175_23.html,,Subscribe,https://img.lemde.fr/2025/02/13/0/0/0/0/100/100/60/0/e49d71b_sirius-fs-upload-1-hfccvvna5map-1739442970267-capture-da-a-cran-2025-02-13-113500.png,Philippe Bernard,Column
'No region is safe from climate change: Brittany will not be a climate refuge',https://www.lemonde.fr/en/opinion/article/2026/07/12/no-region-is-safe-from-climate-change-brittany-will-not-be-a-climate-refuge_6755386_23.html,,Subscribe,,Antoine Poincaré  and  Clément Jeanneau,Op-Ed
